Symbol,Name,Last Sale,Net Change,% Change,Market Cap,Country,IPO Year,Volume,Sector,Industry
JUNS,Jupiter Neurosciences Inc. Common Stock,$8.55,-0.10,-1.156%,283038003.00,United States,2024,486506,Health Care,Biotechnology: Pharmaceutical Preparations
JVA,Coffee Holding Co. Inc. Common Stock,$3.74,0.02,0.538%,21350160.00,United States,2005,56818,Consumer Staples,Packaged Foods
JVSA,JV SPAC Acquisition Corp. Class A Ordinary Share,$10.49,0.01,0.095%,0.00,China,2024,321,,
JWEL,Jowell Global Ltd. Ordinary Shares,$2.96,-0.0693,-2.288%,6424606.00,China,2021,6064,Consumer Discretionary,Other Consumer Services
JWN,Nordstrom Inc. Common Stock,$24.01,-0.08,-0.332%,3959415533.00,United States,,3658750,Consumer Discretionary,Clothing/Shoe/Accessory Stores
JXG,JX Luxventure Group Inc. Common Stock,$3.385,-0.415,-10.921%,5130976.00,China,2013,63389,Consumer Staples,Apparel
JXN,Jackson Financial Inc. Class A Common Stock ,$84.55,-4.06,-4.582%,6245013245.00,United States,2021,622182,Finance,Life Insurance
JXN^A,Jackson Financial Inc. Depositary Shares each representing a 1/1000th interest in a share of Fixed-Rate Reset Noncumulative Perpetual Preferred Stock Series A,$25.81,-0.54,-2.049%,,United States,,47624,,
JYD,Jayud Global Logistics Limited Class A Ordinary Shares,$2.51,0.48,23.645%,53594080.00,China,2023,470410,Consumer Discretionary,Oil Refining/Marketing
JYNT,The Joint Corp. Common Stock,$10.03,-0.14,-1.377%,150285598.00,United States,2014,69691,Miscellaneous,Multi-Sector Companies
JZ,Jianzhi Education Technology Group Company Limited American Depositary Shs,$0.93,-0.019,-2.002%,18772050.00,China,2022,6364,Real Estate,Other Consumer Services
JZXN,Jiuzi Holdings Inc. Ordinary Shares,$1.51,-0.08,-5.031%,13671537.00,China,2021,51104,Consumer Discretionary,Retail-Auto Dealers and Gas Stations
K,Kellanova Common Stock,$81.51,-0.03,-0.037%,28096325340.00,United States,,1821051,Consumer Staples,Packaged Foods
KAI,Kadant Inc Common Stock,$340.97,-4.16,-1.205%,4004803124.00,United States,1992,143066,Industrials,Industrial Machinery/Components
KALA,KALA BIO Inc. Common Stock,$6.81,-0.01,-0.147%,31395047.00,United States,2017,36908,Health Care,Biotechnology: Pharmaceutical Preparations
KALU,Kaiser Aluminum Corporation Common Stock,$70.21,-0.17,-0.242%,1129538831.00,United States,,98567,Industrials,Metal Fabrications
KALV,KalVista Pharmaceuticals Inc. Common Stock,$7.85,-0.39,-4.733%,387931190.00,United Kingdom,2015,418445,Health Care,Biotechnology: Pharmaceutical Preparations
KAPA,Kairos Pharma Ltd. Common Stock,$0.97,-0.06,-5.825%,12461381.00,,2024,159164,Health Care,Biotechnology: Pharmaceutical Preparations
KAR,OPENLANE Inc. Common Stock,$19.76,-0.52,-2.564%,2111243388.00,United States,2009,418020,Consumer Discretionary,Retail-Auto Dealers and Gas Stations
KARO,Karooooo Ltd. Ordinary Shares,$48.24,-1.76,-3.52%,1490616000.00,Singapore,2021,26300,Technology,Computer Software: Prepackaged Software
KAVL,Kaival Brands Innovations Group Inc. Common Stock,$1.12,0.12,12.00%,7598033.00,United States,,3006785,Consumer Discretionary,Other Consumer Services
KB,KB Financial Group Inc,$59.04,0.81,1.391%,22356312228.00,South Korea,,197109,Finance,Commercial Banks
KBDC,Kayne Anderson BDC Inc. Common Stock,$16.55,-0.15,-0.898%,0.00,,2024,94765,,
KBH,KB Home Common Stock,$63.19,-2.15,-3.29%,4634005602.00,United States,1986,1368704,Consumer Discretionary,Homebuilding
KBR,KBR Inc. Common Stock,$58.34,0.83,1.443%,7773338280.00,United States,2006,1407070,Industrials,Military/Government/Technical
KC,Kingsoft Cloud Holdings Limited American Depositary Shares,$10.21,-0.17,-1.638%,2590130517.00,China,2020,1582788,Technology,Computer Software: Prepackaged Software
KD,Kyndryl Holdings Inc. Common Stock,$36.74,-0.98,-2.598%,8533634042.00,United States,2021,1981214,Technology,EDP Services
KDLY,Kindly MD Inc. Common Stock,$1.43,-0.20,-12.27%,8547791.00,United States,2024,245185,Health Care,Medical/Nursing Services
KDLYW,Kindly MD Inc. Warrants,$0.2102,-0.1108,-34.517%,1256465.00,United States,2024,1673,Health Care,Medical/Nursing Services
KDP,Keurig Dr Pepper Inc. Common Stock,$30.38,-0.74,-2.378%,41209061857.00,United States,,9590410,Consumer Staples,Beverages (Production/Distribution)
KE,Kimball Electronics Inc. Common Stock,$18.11,-0.28,-1.523%,446966590.00,United States,,133643,Technology,Electrical Products
KELYA,Kelly Services Inc. Class A Common Stock,$13.25,-0.57,-4.124%,471830274.00,United States,,350671,Consumer Discretionary,Professional Services
KELYB,Kelly Services Inc. Class B Common Stock,$14.22,0.00,0.00%,506371811.00,United States,,66,Consumer Discretionary,Professional Services
KEN,Kenon Holdings Ltd. Ordinary Shares,$31.54,0.15,0.478%,1664234751.00,Singapore,2015,7532,Utilities,Electric Utilities: Central
KEP,Korea Electric Power Corporation Common Stock,$6.87,-0.14,-1.997%,8820586418.00,South Korea,1994,189564,Utilities,Electric Utilities: Central
KEQU,Kewaunee Scientific Corporation Common Stock,$57.73,-3.55,-5.793%,165789476.00,United States,,26468,Industrials,Medical Specialities
KEX,Kirby Corporation Common Stock,$103.90,-1.14,-1.085%,5963860000.00,United States,,643985,Consumer Discretionary,Marine Transportation
KEY,KeyCorp Common Stock,$16.72,-0.39,-2.279%,16574251526.00,United States,,15747065,Finance,Major Banks
KEY^I,KeyCorp Depositary Shares Each Representing a 1/40th Ownership Interest in a Share of Fixed-to-Floating Rate Perpetual Non-Cumulative Preferred Stock Series E,$24.32,-0.34,-1.379%,,United States,,38309,,
KEY^J,KeyCorp Depositary Shares each representing a 1/40th ownership interest in a share of Fixed Rate Perpetual Non-Cumulative Preferred Stock Series F,$20.42,-0.79,-3.725%,,United States,,110362,,
KEY^K,KeyCorp Depositary Shares each representing a 1/40th ownership interest in a share of Fixed Rate Perpetual Non-Cumulative Preferred Stock Series G,$20.83,-0.73,-3.386%,,United States,,36512,,
KEY^L,KeyCorp Depositary Shares each representing a 1/40th ownership interest in a share of Fixed Rate Perpetual Non-Cumulative Preferred Stock Series H,$24.08,-0.12,-0.496%,,United States,,92811,,
KEYS,Keysight Technologies Inc. Common Stock,$161.31,-3.58,-2.171%,27934498561.00,United States,2014,660320,Industrials,Industrial Machinery/Components
KF,Korea Fund Inc. (The) New Common Stock,$19.59,-0.24,-1.21%,0.00,United States,,3793,Finance,Investment Managers
KFFB,Kentucky First Federal Bancorp Common Stock,$3.00,0.00,0.00%,24260145.00,United States,2005,111,Finance,Savings Institutions
KFRC,Kforce Inc. Common Stock,$53.76,-2.01,-3.604%,1025740800.00,United States,1995,99914,Consumer Discretionary,Professional Services
KFS,Kingsway Financial Services Inc. Common Stock (DE),$8.01,-0.05,-0.62%,220858056.00,Canada,,65948,Finance,Property-Casualty Insurers
KFY,Korn Ferry Common Stock,$65.42,-0.66,-0.999%,3374560580.00,United States,1999,291228,Consumer Discretionary,Diversified Commercial Services
KGC,Kinross Gold Corporation Common Stock,$10.44,0.06,0.578%,12830760000.00,Canada,2001,28582149,Basic Materials,Precious Metals
KGEI,Kolibri Global Energy Inc. Common stock,$6.22,0.24,4.013%,222277702.00,United States,,71293,Energy,Oil & Gas Production
KGS,Kodiak Gas Services Inc. Common Stock,$42.00,0.32,0.768%,3677926518.00,United States,2023,745474,Utilities,Natural Gas Distribution
KHC,The Kraft Heinz Company Common Stock,$28.51,-1.15,-3.877%,34473576228.00,United States,,14236758,Consumer Staples,Packaged Foods
KIDS,OrthoPediatrics Corp. Common Stock,$24.44,0.27,1.117%,591837476.00,United States,2017,327337,Health Care,Medical/Dental Instruments
KIM,Kimco Realty Corporation (HC) Common Stock,$21.66,-0.38,-1.724%,14600603276.00,United States,,5052648,Real Estate,Real Estate Investment Trusts
KIM^L,Kimco Realty Corporation Class L Depositary Shares each of which represents a one-one thousandth fractional interest in a share of 5.125% Class L Cumulative Redeemable Preferred Stock liquidation preference $25000.00 per share,$20.55,-0.13,-0.629%,,United States,,36849,,
KIM^M,Kimco Realty Corporation Class M Depositary Shares each of which represents a one-one thousandth fractional interest in a share of 5.25% Class M Cumulative Redeemable Preferred Stock liquidation preference $25000.00 per share,$21.11,-0.34,-1.585%,,United States,,23919,,
KIM^N,Kimco Realty Corporation Depositary Shares each representing 1/1000th interest in a share of 7.25% Class N Cumulative Convertible Perpetual Preferred Stock,$60.00,-0.28,-0.464%,,United States,,1863,,
KIND,Nextdoor Holdings Inc. Class A Common Stock,$2.35,-0.01,-0.424%,898036313.00,United States,,1222000,Technology,Computer Software: Programming Data Processing
KINS,Kingstone Companies Inc. Common Stock,$14.17,-0.51,-3.474%,174987200.00,United States,,250446,Finance,Property-Casualty Insurers
KIO,KKR Income Opportunities Fund Common Shares,$13.48,-0.12,-0.882%,0.00,United States,2013,120417,Finance,Investment Managers
KIRK,Kirkland's Inc. COMMONSTOCK,$1.64,-0.01,-0.606%,21513425.00,United States,2002,202396,Consumer Discretionary,Other Specialty Stores
KITT,Nauticus Robotics Inc. Common stock,$3.08,0.16,5.479%,19735023.00,United States,2021,12440684,Industrials,Industrial Machinery/Components
KITTW,Nauticus Robotics Inc. Warrant,$0.169,0.0358,26.877%,1082863.00,United States,2021,329861,Industrials,Industrial Machinery/Components
KKR,KKR & Co. Inc. Common Stock,$140.93,-7.31,-4.931%,125178100145.00,United States,,3968578,Finance,Investment Managers
KKRS,KKR Group Finance Co. IX LLC 4.625% Subordinated Notes due 2061,$18.10,-0.17,-0.93%,16076943253.00,United States,2021,41474,,
KLAC,KLA Corporation Common Stock,$683.06,-3.14,-0.458%,91365953961.00,United States,1980,1254450,Technology,Electronic Components
KLC,KinderCare Learning Companies Inc. Common Stock,$17.99,-0.54,-2.914%,2122209941.00,,2024,565350,Consumer Discretionary,Other Consumer Services
KLG,WK Kellogg Co Common Stock,$15.55,-0.77,-4.718%,1339247544.00,United States,2023,1659394,Consumer Staples,Packaged Foods
KLIC,Kulicke and Soffa Industries Inc. Common Stock,$46.21,-1.33,-2.798%,2489390740.00,Singapore,,339473,Technology,Semiconductors
KLTO,Klotho Neurosciences Inc. Common Stock,$0.495,0.0469,10.466%,10525440.00,United States,2022,120399,Health Care,Biotechnology: Biological Products (No Diagnostic Substances)
KLTOW,Klotho Neurosciences Inc. Warrant,$0.071,0.0074,11.635%,1509710.00,United States,2022,48388,Health Care,Biotechnology: Biological Products (No Diagnostic Substances)
KLTR,Kaltura Inc. Common Stock,$2.04,-0.20,-8.929%,305378451.00,United States,2021,764704,Technology,Computer Software: Prepackaged Software
KLXE,KLX Energy Services Holdings Inc. Common Stock,$5.21,0.10,1.957%,87842351.00,United States,,83080,Energy,Oilfield Services/Equipment
KMB,Kimberly-Clark Corporation Common Stock,$124.46,-2.31,-1.822%,41505581060.00,United States,,2279979,Consumer Discretionary,Containers/Packaging
KMDA,Kamada Ltd. Ordinary Shares,$7.41,0.09,1.23%,332264400.00,Israel,2013,515918,Health Care,Biotechnology: Pharmaceutical Preparations
KMI,Kinder Morgan Inc. Common Stock,$28.16,-0.13,-0.46%,62561386483.00,United States,2011,11812869,Utilities,Natural Gas Distribution
KMPB,Kemper Corporation 5.875% Fixed-Rate Reset Junior Subordinated Debentures due 2062,$23.17,0.04,0.173%,1483933656.00,United States,2022,6802,Finance,Property-Casualty Insurers
KMPR,Kemper Corporation,$62.81,-1.97,-3.041%,4022696285.00,United States,,293003,Finance,Property-Casualty Insurers
KMT,Kennametal Inc. Common Stock,$23.81,-0.52,-2.137%,1850653250.00,United States,,1158598,Industrials,Industrial Machinery/Components
KMX,CarMax Inc,$78.34,-3.59,-4.382%,12048689963.00,United States,,1793605,Consumer Discretionary,Retail-Auto Dealers and Gas Stations
KN,Knowles Corporation Common Stock,$19.44,-0.50,-2.508%,1712059086.00,United States,2014,487193,Consumer Staples,Consumer Electronics/Appliances
KNDI,Kandi Technologies Group Inc. Ordinary Shares,$1.02,-0.04,-3.774%,89105399.00,China,,139233,Consumer Discretionary,Auto Manufacturing
KNF,Knife Riv Holding Co. Common Stock,$95.21,-3.03,-3.084%,5390095643.00,United States,2023,512396,Industrials,Mining & Quarrying of Nonmetallic Minerals (No Fuels)
KNOP,KNOT Offshore Partners LP Common Units representing Limited Partner Interests,$6.09,-0.19,-3.025%,207334543.00,United Kingdom,2013,126730,Consumer Discretionary,Marine Transportation
KNSA,Kiniksa Pharmaceuticals International plc Class A Ordinary Shares,$19.93,-0.37,-1.823%,1438977190.00,United States,2018,418456,Health Care,Biotechnology: Pharmaceutical Preparations
KNSL,Kinsale Capital Group Inc. Common Stock,$416.48,-5.55,-1.315%,9698977077.00,United States,,276895,Finance,Property-Casualty Insurers
KNTK,Kinetik Holdings Inc. Class A Common Stock,$60.41,0.76,1.274%,9516828716.00,United States,2022,461390,Utilities,Natural Gas Distribution
KNW,Know Labs Inc. Common Stock,$0.1467,-0.0175,-10.658%,15857967.00,,2022,3542103,Industrials,Industrial Machinery/Components
KNX,Knight-Swift Transportation Holdings Inc.,$52.37,-1.46,-2.712%,8478336410.00,United States,2017,1415591,Industrials,Trucking Freight/Courier Services
KO,Coca-Cola Company (The) Common Stock,$61.07,-0.64,-1.037%,263077171218.00,United States,,22417982,Consumer Staples,Beverages (Production/Distribution)
KOD,Kodiak Sciences Inc Common Stock,$8.32,-0.88,-9.565%,437829800.00,United States,2018,443928,Health Care,Biotechnology: Biological Products (No Diagnostic Substances)
KODK,Eastman Kodak Company Common New,$6.19,0.04,0.65%,497676000.00,United States,,821126,Consumer Discretionary,Industrial Machinery/Components
KOF,Coca Cola Femsa S.A.B. de C.V.  American Depositary Shares each representing 10 Units (each Unit consists of 3 Series B Shares and 5 Series L Shares),$74.50,-1.60,-2.102%,15651200337.00,Mexico,1993,160357,Consumer Staples,Beverages (Production/Distribution)
KOP,Koppers Holdings Inc. Common Stock,$29.62,-0.70,-2.309%,600365618.00,United States,2006,130165,Basic Materials,Forest Products
KOPN,Kopin Corporation Common Stock,$1.25,-0.06,-4.58%,198500750.00,United States,1992,1309767,Technology,Semiconductors
KORE,KORE Group Holdings Inc. Common Stock,$1.94,-0.09,-4.433%,32996211.00,United States,,100990,Telecommunications,Telecommunications Equipment
KOS,Kosmos Energy Ltd. Common Shares (DE),$3.69,-0.06,-1.60%,1741294321.00,Bermuda,2011,9034886,Energy,Oil & Gas Production
KOSS,Koss Corporation Common Stock,$7.33,-0.18,-2.397%,68541327.00,United States,,96990,Consumer Staples,Consumer Electronics/Appliances
KPLT,Katapult Holdings Inc. Common Stock,$6.4128,-0.3872,-5.694%,28155520.00,United States,2019,14425,Consumer Discretionary,Diversified Commercial Services
KPLTW,Katapult Holdings Inc. Warrant,$0.0079,0.00,0.00%,34685.00,United States,2019,14719,Consumer Discretionary,Diversified Commercial Services
KPRX,Kiora Pharmaceuticals Inc.  Common Stock,$3.5235,-0.2022,-5.427%,10573277.00,United States,,65090,Health Care,Biotechnology: Pharmaceutical Preparations
KPTI,Karyopharm Therapeutics Inc. Common Stock,$0.7186,0.0026,0.363%,90051004.00,United States,2013,847414,Health Care,Biotechnology: Pharmaceutical Preparations
KR,Kroger Company (The) Common Stock,$59.12,0.22,0.374%,42779594406.00,United States,,5925842,Consumer Staples,Food Chains
KRC,Kilroy Realty Corporation Common Stock,$35.54,-1.53,-4.127%,4195378794.00,United States,1997,1380338,Real Estate,Real Estate Investment Trusts
KREF,KKR Real Estate Finance Trust Inc. Common Stock,$9.92,-0.13,-1.294%,690160698.00,United States,2017,709038,Real Estate,Real Estate Investment Trusts
KREF^A,KKR Real Estate Finance Trust Inc. 6.50% Series A Cumulative Redeemable Preferred Stock,$19.20,0.00,0.00%,,United States,,27100,,
KRG,Kite Realty Group Trust Common Stock,$22.64,-1.15,-4.834%,4973241161.00,United States,2004,2321700,Real Estate,Real Estate Investment Trusts
KRKR,36Kr Holdings Inc. American Depositary Shares,$3.3675,0.1775,5.564%,6567585.00,China,2019,6638,Consumer Discretionary,Business Services
KRMD,KORU Medical Systems Inc. Common Stock (DE),$3.96,-0.04,-1.00%,181515724.00,United States,,26484,Health Care,Medical/Dental Instruments
KRNT,Kornit Digital Ltd. Ordinary Shares,$29.77,-0.32,-1.063%,1420613474.00,Israel,2015,270484,Industrials,Industrial Machinery/Components
KRNY,Kearny Financial Corp Common Stock,$6.69,-0.25,-3.602%,432038079.00,United States,2005,371892,Finance,Savings Institutions
KRO,Kronos Worldwide Inc Common Stock,$8.92,-0.17,-1.87%,1026123939.00,United States,,148233,Industrials,Major Chemicals
KRON,Kronos Bio Inc. Common Stock,$0.9564,-0.0286,-2.904%,57710054.00,United States,2020,271143,Health Care,Biotechnology: Pharmaceutical Preparations
KROS,Keros Therapeutics Inc. Common Stock,$14.56,-0.33,-2.216%,589787875.00,United States,2020,1609663,Health Care,Biotechnology: Pharmaceutical Preparations
KRP,Kimbell Royalty Partners Common Units Representing Limited Partner Interests,$15.56,0.15,0.973%,1485883077.00,United States,2017,1809470,Energy,Oil & Gas Production
KRRO,Korro Bio Inc. Common Stock,$35.26,-2.36,-6.273%,330324918.00,United States,2019,107208,Health Care,Biotechnology: Pharmaceutical Preparations
KRT,Karat Packaging Inc. Common Stock,$27.87,-1.04,-3.597%,558071806.00,United States,2021,40433,Industrials,Plastic Products
KRUS,Kura Sushi USA Inc. Class A Common Stock,$87.57,-2.52,-2.797%,1056631179.00,United States,2019,243404,Consumer Discretionary,Restaurants
KRYS,Krystal Biotech Inc. Common Stock,$152.92,-3.75,-2.394%,4398063000.00,United States,2017,455648,Health Care,Biotechnology: Biological Products (No Diagnostic Substances)
KSCP,Knightscope Inc. Class A Common Stock,$12.10,-0.81,-6.274%,46203245.00,United States,2022,186984,Telecommunications,Telecommunications Equipment
KSPI,Joint Stock Company Kaspi.kz American Depository Shares,$91.63,-4.07,-4.253%,17348625398.00,Kazakhstan,2024,278580,,
KSS,Kohl's Corporation Common Stock,$13.68,0.19,1.408%,1522823455.00,United States,1992,5856451,Consumer Discretionary,Department/Specialty Retail Stores
KT,KT Corporation Common Stock,$15.57,-0.23,-1.456%,7673313961.00,South Korea,,1148928,Telecommunications,Telecommunications Equipment
KTB,Kontoor Brands Inc. Common Stock ,$86.29,-1.69,-1.921%,4758157619.00,United States,2019,328498,Consumer Discretionary,Apparel
KTCC,Key Tronic Corporation Common Stock,$4.12,-0.14,-3.286%,44338909.00,United States,1983,36427,Technology,Electrical Products
KTF,DWS Municipal Income Trust,$9.42,-0.14,-1.464%,372098836.00,United States,1988,122992,Finance,Finance Companies
KTH,Structures Products Cp 8% CorTS Issued by Peco Energy Cap Tr II Preferred Stock,$29.01,0.00,0.00%,0.00,United States,,1345,Finance,Finance: Consumer Services
KTN,Structured Products Corp 8.205% CorTS 8.205% Corporate Backed Trust Securities (CorTS),$26.3009,0.0282,0.107%,0.00,United States,,3013,Finance,Finance: Consumer Services
KTOS,Kratos Defense & Security Solutions Inc. Common Stock,$29.37,0.43,1.486%,4437040032.00,United States,,1739562,Industrials,Military/Government/Technical
KTTA,Pasithea Therapeutics Corp. Common Stock,$2.56,-0.24,-8.571%,3242053.00,United States,2021,18830,Health Care,Biotechnology: Pharmaceutical Preparations
KUKE,Kuke Music Holding Limited American Depositary Shares each representing one Ordinary Share,$0.4599,0.0399,9.50%,15292467.00,,2021,125436,Real Estate,Other Consumer Services
KULR,KULR Technology Group Inc. Common Stock,$2.41,-0.37,-13.309%,516289017.00,United States,,27904660,Technology,Electrical Products
KURA,Kura Oncology Inc. Common Stock,$7.32,-0.46,-5.913%,569230650.00,United States,,1577144,Health Care,Biotechnology: Pharmaceutical Preparations
KVAC,Keen Vision Acquisition Corporation Ordinary Shares,$11.00,0.00,0.00%,0.00,United States,2023,256,,
KVACU,Keen Vision Acquisition Corporation Units,$11.03,0.04,0.364%,0.00,United States,2023,6473,,
KVACW,Keen Vision Acquisition Corporation Warrant,$0.075,0.0025,3.448%,0.00,United States,2023,641,,
KVHI,KVH Industries Inc. Common Stock,$5.74,0.05,0.879%,113646960.00,United States,1996,63375,Technology,Radio And Television Broadcasting And Communications Equipment
KVUE,Kenvue Inc. Common Stock,$20.85,-0.25,-1.185%,39974817582.00,United States,2023,11057093,Consumer Discretionary,Specialty Chemicals
KVYO,Klaviyo Inc. Series A Common Stock,$39.41,-1.69,-4.112%,10626260137.00,United States,2023,1541088,Technology,Computer Software: Prepackaged Software
KW,Kennedy-Wilson Holdings Inc. Common Stock,$8.86,-0.39,-4.216%,1217469638.00,United States,,692760,Finance,Real Estate
KWE,KWESST Micro Systems Inc. Common Stock,$0.68,-0.001,-0.147%,5363312.00,Canada,,725250,Technology,Computer Software: Prepackaged Software
KWESW,KWESST Micro Systems Inc. Warrant,$0.0675,-0.0007,-1.026%,532388.00,Canada,,8914,Technology,Computer Software: Prepackaged Software
KWR,Quaker Houghton Common Stock,$125.10,-6.15,-4.686%,2225255406.00,United States,,248910,Industrials,Major Chemicals
KXIN,Kaixin Holdings Ordinary Shares,$1.56,0.01,0.645%,1539073.00,China,2017,392233,Consumer Discretionary,Retail-Auto Dealers and Gas Stations
KYMR,Kymera Therapeutics Inc. Common Stock,$38.17,-2.35,-5.80%,2472090509.00,United States,2020,595686,Health Care,Biotechnology: Biological Products (No Diagnostic Substances)
KYN,Kayne Anderson Energy Infrastructure Fund Inc.,$12.90,-0.12,-0.922%,1756096737.00,United States,2004,536803,Finance,Finance/Investors Services
KYTX,Kyverna Therapeutics Inc. Common Stock,$3.45,-0.35,-9.211%,148942061.00,United States,2024,388980,Health Care,Biotechnology: Biological Products (No Diagnostic Substances)
KZIA,Kazia Therapeutics Limited American Depositary Shares,$1.58,-0.11,-6.509%,5259043.00,Australia,,154393,Health Care,Biotechnology: Pharmaceutical Preparations
KZR,Kezar Life Sciences Inc. Common Stock,$6.51,-0.07,-1.064%,47498405.00,United States,2018,21361,Health Care,Biotechnology: Pharmaceutical Preparations
L,Loews Corporation Common Stock,$81.13,-2.40,-2.873%,17668226754.00,United States,,860988,Finance,Property-Casualty Insurers
LAAC,Lithium Americas (Argentina) Corp. Common Shares,$2.89,-0.09,-3.02%,466157000.00,Canada,2023,851414,Basic Materials,Metal Mining
LAB,Standard BioTools Inc. Common Stock,$1.63,-0.12,-6.857%,606781841.00,United States,2011,1530653,Industrials,Biotechnology: Laboratory Analytical Instruments
LAC,Lithium Americas Corp. Common Shares,$3.14,-0.15,-4.559%,506482000.00,Canada,2023,4667616,Basic Materials,Metal Mining
LAD,Lithia Motors Inc. Common Stock,$341.80,-7.25,-2.077%,9104579921.00,United States,,250591,Consumer Discretionary,Retail-Auto Dealers and Gas Stations
LADR,Ladder Capital Corp Class A Common Stock,$10.81,-0.22,-1.995%,1379766575.00,United States,2014,898207,Real Estate,Real Estate Investment Trusts
LAES,SEALSQ Corp Ordinary Shares,$5.73,0.455,8.626%,133967400.00,Switzerland,,57690203,Technology,Semiconductors
LAKE,Lakeland Industries Inc. Common Stock,$26.22,1.07,4.254%,194174937.00,United States,1986,87909,Health Care,Industrial Specialties
LAMR,Lamar Advertising Company Class A Common Stock,$118.64,-1.55,-1.29%,12143730222.00,United States,1996,280523,Real Estate,Real Estate Investment Trusts
LANC,Lancaster Colony Corporation Common Stock,$166.74,-2.96,-1.744%,4596188100.00,United States,,147853,Consumer Staples,Packaged Foods
LAND,Gladstone Land Corporation Common Stock,$10.40,-0.21,-1.979%,376320443.00,United States,2013,299364,Real Estate,Real Estate Investment Trusts
LANDM,Gladstone Land Corporation 5.00% Series D Cumulative Term Preferred Stock,$24.68,0.00,0.00%,893037359.00,United States,,2794,Real Estate,Real Estate Investment Trusts
LANDO,Gladstone Land Corporation 6.00% Series B Cumulative Redeemable Preferred Stock,$20.27,-0.27,-1.315%,733463018.00,United States,,6731,Real Estate,Real Estate Investment Trusts
LANDP,Gladstone Land Corporation 6.00% Series C Cumulative Redeemable Preferred Stock,$20.16,-0.35,-1.706%,729482705.00,United States,,10116,Real Estate,Real Estate Investment Trusts
LANV,Lanvin Group Holdings Limited Ordinary Shares,$1.84,-0.07,-3.665%,240986769.00,Cayman Islands,1996,28045,Finance,Blank Checks
LARK,Landmark Bancorp Inc. Common Stock,$22.92,-0.08,-0.348%,132392383.00,United States,,10174,Finance,Major Banks
LASE,Laser Photonics Corporation Common Stock,$5.17,0.00,0.00%,71513482.00,United States,2022,198211,Miscellaneous,Industrial Machinery/Components
LASR,nLIGHT Inc. Common Stock,$11.14,-0.18,-1.59%,539503026.00,United States,2018,324292,Technology,Semiconductors
LATG,Chenghe Acquisition I Co. Class A Ordinary Shares,$7.0501,-1.9099,-21.316%,114564125.00,Mexico,2022,73849,Finance,Blank Checks
LATGU,Chenghe Acquisition I Co. Unit,$13.63,-0.38,-2.712%,0.00,Mexico,2022,9943,Finance,Blank Checks
LAUR,Laureate Education Inc. Common Stock,$18.04,-0.64,-3.426%,2718356155.00,United States,2017,529070,Real Estate,Other Consumer Services
LAW,CS Disco Inc. Common Stock,$4.92,0.01,0.204%,294751129.00,United States,2021,127595,Technology,Computer Software: Prepackaged Software
LAZ,Lazard Inc. Common Stock,$47.30,-2.72,-5.438%,5333836104.00,Bermuda,2005,1205245,Finance,Investment Managers
LAZR,Luminar Technologies Inc.  Class A Common Stock,$7.40,-0.43,-5.492%,246391229.00,United States,2019,2381842,Consumer Discretionary,Auto Parts:O.E.M.
LB,LandBridge Company LLC Class A Shares Representing Limited Liability Company Interests,$73.70,1.73,2.404%,5391273141.00,,2024,412304,Energy,Oil & Gas Production
LBGJ,Li Bang International Corporation Inc. Ordinary Shares,$3.22,-0.02,-0.617%,59634400.00,China,2024,138045,,
LBRDA,Liberty Broadband Corporation Class A Common Stock,$72.73,-2.92,-3.86%,10389341877.00,United States,,77929,Telecommunications,Cable & Other Pay Television Services
LBRDK,Liberty Broadband Corporation Class C Common Stock,$73.49,-2.81,-3.683%,10497906428.00,United States,,439641,Telecommunications,Cable & Other Pay Television Services
