Symbol,Name,Last Sale,Net Change,% Change,Market Cap,Country,IPO Year,Volume,Sector,Industry
PSA^F,Public Storage Depositary Shares Each Representing 1/1000 of a 5.15% Cumulative Preferred Share of Beneficial Interest Series F par value $0.01 per share,$21.49,-0.47,-2.14%,,United States,,32007,,
PSA^G,Public Storage Depositary Shares Each Representing 1/1000 of a 5.05% Cumulative Preferred Share of Beneficial Interest Series G,$21.51,-0.31,-1.421%,,United States,,66628,,
PSA^H,Public Storage Depositary Shares Each Representing 1/1000 of a  5.60% Cumulative Preferred  Share of Beneficial Interest Series H,$23.27,-0.21,-0.894%,,United States,,31744,,
PSA^I,Public Storage Depositary Shares Each Representing 1/1000 of a 4.875% Cumulative Preferred Share of Beneficial Interest Series I par value $0.01 per share,$20.78,-0.35,-1.656%,,United States,,23693,,
PSA^J,Public Storage Depositary Shares Each Representing 1/1000 of a 4.700% Cumulative Preferred Share of Beneficial Interest Series J par value $0.01 per share,$19.52,-0.38,-1.91%,,United States,,16771,,
PSA^K,Public Storage Depositary Shares Each Representing 1/1000 of a 4.75% Cumulative Preferred Share of Beneficial Interest Series K,$19.85,-0.29,-1.44%,,United States,,23336,,
PSA^L,Public Storage Depositary Shares Each Representing 1/1000 of a 4.625% Cumulative Preferred Share of Beneficial Interest Series L par value $0.01 per share,$19.43,-0.32,-1.62%,,United States,,35798,,
PSA^M,Public Storage Depositary Shares Each Representing 1/1000 of a 4.125% Cumulative Preferred Share of Beneficial Interest Series M,$17.26,-0.39,-2.21%,,United States,,19974,,
PSA^N,Public Storage Depositary Shares Each Representing 1/1000 of a 3.875% Cumulative Preferred Share of Beneficial Interest Series N,$16.07,-0.31,-1.893%,,United States,,32471,,
PSA^O,Public Storage Depositary Shares Each Representing 1/1000 of a 3.900% Cumulative Preferred Share of Beneficial Interest Series O,$16.3741,-0.2759,-1.657%,,United States,,21144,,
PSA^P,Public Storage Depositary Shares Each Representing 1/1000 of a 4.000% Cumulative Preferred Share of Bene cial Interest Series P,$16.84,-0.29,-1.693%,,United States,,41113,,
PSA^Q,Public Storage Depositary Shares Each Representing 1/1000 of a 3.950% Cumulative Preferred Share of Beneficial Interest Series Q par value $0.01 per share,$16.42,-0.2844,-1.703%,,United States,,13015,,
PSA^R,Public Storage Depositary Shares Each Representing 1/1000 of a 4.00% Cumulative Preferred Share of Bene cial Interest Series R,$16.63,-0.30,-1.772%,,United States,,76319,,
PSA^S,Public Storage Depositary Shares Each Representing 1/1000 of a 4.100% Cumulative Preferred Share of Beneficial Interest Series S,$17.36,-0.30,-1.699%,,United States,,18018,,
PSBD,Palmer Square Capital BDC Inc. Common Stock,$15.15,-0.19,-1.239%,0.00,,2024,20314,,
PSEC,Prospect Capital Corporation Common Stock,$4.22,-0.02,-0.472%,1840662648.00,United States,2004,2751983,Finance,Finance: Consumer Services
PSEC^A,Prospect Capital Corporation 5.35% Series A Fixed Rate Cumulative Perpetual Preferred Stock,$17.02,-1.0313,-5.713%,,United States,,18399,,
PSF,Cohen & Steers Select Preferred and Income Fund Inc. Common Stock,$19.64,-0.20,-1.008%,965082654.00,,2010,38155,Finance,Investment Managers
PSFE,Paysafe Limited Common Shares,$17.23,0.08,0.466%,1063426003.00,,2021,410360,Consumer Discretionary,Business Services
PSHG,Performance Shipping Inc. Common Shares,$1.89,0.045,2.439%,23208588.00,Greece,,82367,Consumer Discretionary,Marine Transportation
PSIG,PS International Group Ltd. Ordinary Shares,$0.529,-0.0911,-14.691%,12845674.00,Hong Kong,,2322449,Consumer Discretionary,Oil Refining/Marketing
PSIX,Power Solutions International Inc. Common Stock,$35.80,3.25,9.985%,823386253.00,United States,,288694,Industrials,Industrial Machinery/Components
PSMT,PriceSmart Inc. Common Stock,$89.25,-4.20,-4.494%,2736614291.00,United States,,485408,Consumer Discretionary,Department/Specialty Retail Stores
PSN,Parsons Corporation Common Stock,$92.54,0.68,0.74%,9826817880.00,United States,2019,831182,Technology,EDP Services
PSNL,Personalis Inc. Common Stock,$5.59,-0.01,-0.179%,394922790.00,United States,2019,1095373,Health Care,Medical Specialities
PSNY,Polestar Automotive Holding UK PLC Class A ADS,$1.15,0.04,3.604%,2455491831.00,Sweden,,5217837,Consumer Discretionary,Auto Manufacturing
PSNYW,Polestar Automotive Holding UK PLC Class C-1 ADS (ADW),$0.2195,0.0099,4.723%,468678658.00,Sweden,,195727,Consumer Discretionary,Auto Manufacturing
PSO,Pearson Plc Common Stock,$15.74,-0.36,-2.236%,10487008440.00,United Kingdom,,373356,Consumer Discretionary,Books
PSQH,PSQ Holdings Inc. Class A Common Stock,$3.91,-0.14,-3.457%,135920288.00,,2021,794163,Consumer Discretionary,Advertising
PSTG,Pure Storage Inc. Class A Common Stock,$64.73,0.47,0.731%,21117319198.00,United States,2015,3861465,Technology,Electronic Components
PSTL,Postal Realty Trust Inc. Class A Common Stock,$12.62,-0.12,-0.942%,295981454.00,United States,2019,206368,Real Estate,Real Estate Investment Trusts
PSTV,PLUS THERAPEUTICS Inc. Common Stock ,$1.16,-0.04,-3.333%,6839746.00,United States,,16146,Health Care,Medical/Dental Instruments
PSX,Phillips 66 Common Stock,$113.93,-2.32,-1.996%,47051862632.00,United States,,4525787,Energy,Integrated oil Companies
PT,Pintec Technology Holdings Limited American Depositary Shares,$0.9787,-0.0133,-1.341%,15608269.00,China,2018,11674,Technology,Computer Software: Programming Data Processing
PTA,Cohen & Steers Tax-Advantaged Preferred Securities and Income Fund Common Shares of Beneficial Interest,$19.46,-0.15,-0.765%,1075621473.00,United States,2020,178776,Finance,Trusts Except Educational Religious and Charitable
PTC,PTC Inc. Common Stock,$182.38,-1.98,-1.074%,21909141610.00,United States,,858866,Technology,Computer Software: Prepackaged Software
PTCT,PTC Therapeutics Inc. Common Stock,$43.94,-1.10,-2.442%,3388878783.00,United States,2013,548622,Health Care,Biotechnology: Pharmaceutical Preparations
PTEN,Patterson-UTI Energy Inc. Common Stock,$8.50,0.08,0.95%,3314629851.00,United States,1993,8777713,Energy,Oil & Gas Production
PTGX,Protagonist Therapeutics Inc. Common Stock,$36.61,-1.01,-2.685%,2181883439.00,United States,2016,492904,Health Care,Biotechnology: Pharmaceutical Preparations
PTHL,Pheton Holdings Ltd Class A Ordinary Shares,$3.94,-0.06,-1.50%,57130000.00,China,2024,89279,Health Care,Biotechnology: Electromedical & Electrotherapeutic Apparatus
PTIX,Protagenic Therapeutics Inc. Common Stock,$0.48,-0.0682,-12.441%,3261514.00,United States,,436134,Health Care,Biotechnology: Pharmaceutical Preparations
PTIXW,Protagenic Therapeutics Inc. Warrant,$0.0045,0.00,0.00%,30577.00,United States,,10,Health Care,Biotechnology: Pharmaceutical Preparations
PTLE,PTL LTD Ordinary Shares,$12.32,0.265,2.198%,154000000.00,Singapore,2024,1796139,Energy,Oil Refining/Marketing
PTLO,Portillo's Inc. Class A Common Stock,$9.93,0.73,7.935%,737026565.00,United States,2021,2562127,Consumer Discretionary,Restaurants
PTMN,Portman Ridge Finance Corporation Common Stock,$16.10,-0.27,-1.649%,148328962.00,United States,2006,52314,Finance,Finance: Consumer Services
PTN,Palatin Technologies Inc. Common Stock,$1.13,-0.07,-5.833%,22089429.00,United States,1999,153841,Health Care,Biotechnology: Pharmaceutical Preparations
PTON,Peloton Interactive Inc. Class A Common Stock,$8.86,0.23,2.665%,3379728415.00,United States,2019,8504279,Consumer Discretionary,Recreational Games/Products/Toys
PTPI,Petros Pharmaceuticals Inc. Common Stock,$0.3761,0.0121,3.324%,3766593.00,United States,,591448,Health Care,Biotechnology: Pharmaceutical Preparations
PTVE,Pactiv Evergreen Inc. Common stock,$17.53,-0.01,-0.057%,3142976138.00,United States,2020,895635,Consumer Discretionary,Containers/Packaging
PTY,Pimco Corporate & Income Opportunity Fund,$14.40,0.00,0.00%,0.00,United States,2002,759006,Finance,Investment Managers
PUBM,PubMatic Inc. Class A Common Stock,$14.095,-0.645,-4.376%,673272257.00,United States,2020,450783,Technology,Computer Software: Programming Data Processing
PUK,Prudential Public Limited Company Common Stock,$14.64,-0.54,-3.557%,19453060220.00,United Kingdom,,1136109,Finance,Life Insurance
PULM,Pulmatrix Inc. Common Stock,$6.01,0.02,0.334%,21950233.00,United States,2014,51256,Health Care,Biotechnology: Pharmaceutical Preparations
PUMP,ProPetro Holding Corp. Common Stock,$10.19,0.17,1.697%,1048854112.00,United States,2017,1394672,Energy,Oilfield Services/Equipment
PVBC,Provident Bancorp Inc. (MD) Common Stock,$10.61,-0.23,-2.122%,188115756.00,United States,2015,52414,Finance,Banks
PVH,PVH Corp. Common Stock,$99.87,-3.94,-3.795%,5556087484.00,United States,,1116531,Consumer Discretionary,Apparel
PVL,Permianville Royalty Trust Trust Units ,$1.48,0.07,4.965%,48840000.00,United States,2011,155288,Energy,Oil & Gas Production
PVLA,Palvella Therapeutics Inc. Common Stock,$13.97,-0.28,-1.965%,18443753.00,United States,,25245,Health Care,Biotechnology: Pharmaceutical Preparations
PW,Power REIT (MD) Common Stock,$1.3338,0.0338,2.60%,4521130.00,United States,1998,23612,Real Estate,Real Estate Investment Trusts
PW^A,Power REIT 7.75% Series A Cumulative Perpetual Preferred Stock,$4.0401,-0.0399,-0.978%,,United States,,6677,,
PWM,Prestige Wealth Inc. Class A Ordinary Shares,$1.42,0.07,5.185%,12993000.00,Hong Kong,2023,35920,Finance,Finance: Consumer Services
PWOD,Penns Woods Bancorp Inc. Common Stock,$29.03,-0.90,-3.007%,219017735.00,United States,,12315,Finance,Major Banks
PWP,Perella Weinberg Partners Class A Common Stock,$22.33,-0.88,-3.791%,1968690441.00,United States,2020,920514,Finance,Finance: Consumer Services
PWR,Quanta Services Inc. Common Stock,$313.48,1.28,0.41%,46273282801.00,United States,,825642,Industrials,Engineering & Construction
PWUP,PowerUp Acquisition Corp. Class A Ordinary Shares,$11.43,0.00,0.00%,0.00,United States,2022,107,Finance,Blank Checks
PWUPW,PowerUp Acquisition Corp. Warrant,$0.0474,0.0121,34.278%,0.00,United States,2022,5999,Finance,Blank Checks
PX,P10 Inc. Class A Common Stock,$12.71,-0.69,-5.149%,1418725216.00,United States,2021,733166,Finance,Investment Managers
PXLW,Pixelworks Inc.  Common Stock,$0.713,-0.032,-4.295%,42023085.00,United States,2000,230150,Technology,Semiconductors
PXS,Pyxis Tankers Inc. Common Stock,$4.115,0.215,5.513%,43382581.00,Greece,,64616,Consumer Discretionary,Marine Transportation
PXSAW,Pyxis Tankers Inc. Warrant,$0.2297,0.0198,9.433%,2421623.00,Greece,,420,Consumer Discretionary,Marine Transportation
PYCR,Paycor HCM Inc. Common Stock,$22.15,-0.02,-0.09%,3979442797.00,United States,2021,5473541,Technology,Computer Software: Prepackaged Software
PYN,PIMCO New York Municipal Income Fund III Common Shares of Beneficial Interest,$5.68,-0.0601,-1.047%,0.00,United States,2002,29693,Finance,Investment Managers
PYPD,PolyPid Ltd. Ordinary Shares,$3.10,0.11,3.679%,21090782.00,Israel,2020,5315,Health Care,Biotechnology: Pharmaceutical Preparations
PYPL,PayPal Holdings Inc. Common Stock,$83.36,-4.58,-5.208%,83571636702.00,United States,,11324283,Consumer Discretionary,Business Services
PYT,PPlus Tr GSC-2 Tr Ctf Fltg Rate,$22.71,0.01,0.044%,0.00,United States,,150,Finance,Finance: Consumer Services
PYXS,Pyxis Oncology Inc. Common Stock,$1.55,-0.06,-3.727%,92171880.00,United States,2021,814820,Health Care,Biotechnology: Pharmaceutical Preparations
PZC,PIMCO California Municipal Income Fund III Common Shares of Beneficial Interest,$6.74,-0.12,-1.749%,0.00,United States,2002,118575,Finance,Investment Managers
PZG,Paramount Gold Nevada Corp. Common Stock,$0.376,0.016,4.444%,24856851.00,United States,2015,230778,Basic Materials,Metal Mining
PZZA,Papa John's International Inc. Common Stock,$36.81,-1.15,-3.03%,1201538143.00,United States,1993,2031329,Consumer Discretionary,Restaurants
QBTS,D-Wave Quantum Inc. Common Shares,$5.77,-0.33,-5.41%,1292565563.00,,2022,85622639,Technology,EDP Services
QCOM,QUALCOMM Incorporated Common Stock,$156.98,-2.10,-1.32%,174404780000.00,United States,1991,6235620,Technology,Radio And Television Broadcasting And Communications Equipment
QCRH,QCR Holdings Inc. Common Stock,$76.59,-2.88,-3.624%,1291991425.00,United States,,63291,Finance,Major Banks
QD,Qudian Inc. American Depositary Shares each representing one Class A Ordinary Share,$2.60,-0.13,-4.762%,492450013.00,China,2017,325760,Finance,Finance: Consumer Services
QDEL,QuidelOrtho Corporation Common Stock,$45.75,-0.28,-0.608%,3076994803.00,United States,,1038313,Health Care,Biotechnology: In Vitro & In Vivo Diagnostic Substances
QETA,Quetta Acquisition Corporation Common Stock,$10.55,0.00,0.00%,0.00,United States,2023,292,Finance,Blank Checks
QETAR,Quetta Acquisition Corporation Right,$1.70,0.07,4.294%,0.00,United States,2023,15622,Finance,Blank Checks
QFIN,Qifu Technology Inc. American Depositary Shares,$36.09,-1.42,-3.786%,5603134003.00,China,2018,807606,Finance,Finance: Consumer Services
QGEN,Qiagen N.V. Common Shares,$44.68,-0.58,-1.281%,10196099093.00,Netherlands,,990986,Health Care,Biotechnology: Biological Products (No Diagnostic Substances)
QH,Quhuo Limited American Depository Shares,$1.32,0.005,0.38%,8141260.00,China,2020,12773,Consumer Discretionary,Business Services
QIPT,Quipt Home Medical Corp. Common Shares,$3.00,-0.09,-2.913%,129273819.00,United States,,227635,Health Care,Misc Health and Biotechnology Services
QLGN,Qualigen Therapeutics Inc. Common Stock,$4.28,0.11,2.638%,3151925.00,United States,2015,21153,Health Care,Biotechnology: Pharmaceutical Preparations
QLYS,Qualys Inc. Common Stock,$134.02,-0.40,-0.298%,4903852377.00,United States,2012,369585,Technology,Computer Software: Prepackaged Software
QMCO,Quantum Corporation Common Stock,$27.47,-3.96,-12.599%,133187801.00,United States,,1562927,Technology,Electronic Components
QMMM,QMMM Holdings Limited Ordinary Shares,$0.89,-0.03,-3.261%,15241250.00,Hong Kong,2024,233488,Consumer Discretionary,Advertising
QNCX,Quince Therapeutics Inc. Common Stock,$1.79,-0.09,-4.787%,78762941.00,United States,2019,345507,Health Care,Biotechnology: Biological Products (No Diagnostic Substances)
QNRX,Quoin Pharmaceuticals Ltd. American Depositary Shares,$0.6215,-0.0016,-0.257%,3138401.00,Israel,2016,197857,Health Care,Medical/Dental Instruments
QNST,QuinStreet Inc. Common Stock,$21.35,-0.90,-4.045%,1201214410.00,United States,2010,378280,Consumer Discretionary,Business Services
QNTM,Quantum Biopharma Ltd. Class B Subordinate Voting Shares,$3.54,-0.22,-5.851%,4603699.00,Canada,,63384,Health Care,Biotechnology: Pharmaceutical Preparations
QQQX,Nuveen NASDAQ 100 Dynamic Overwrite Fund Shares of Beneficial Interest,$26.58,-0.42,-1.556%,0.00,United States,,112338,Finance,Finance Companies
QRHC,Quest Resource Holding Corporation Common Stock,$5.81,-0.23,-3.808%,119614392.00,United States,,97784,Utilities,Environmental Services
QRTEA,Qurate Retail Inc. Series A Common Stock,$0.3483,-0.0244,-6.547%,138257693.00,United States,,1328801,Consumer Discretionary,Catalog/Specialty Distribution
QRTEB,Qurate Retail Inc. Series B Common Stock,$2.53,-0.01,-0.394%,1004283561.00,United States,,1921,Consumer Discretionary,Catalog/Specialty Distribution
QRTEP,Qurate Retail Inc. 8.0% Fixed Rate Cumulative Redeemable Preferred Stock,$35.81,-0.83,-2.265%,14214780359.00,United States,,45353,Consumer Discretionary,Catalog/Specialty Distribution
QRVO,Qorvo Inc. Common Stock,$71.69,-1.39,-1.902%,6776618980.00,United States,,5207767,Technology,Semiconductors
QS,QuantumScape Corporation Class A Common Stock,$5.61,-0.11,-1.923%,2874963567.00,United States,2020,14549994,Miscellaneous,Industrial Machinery/Components
QSG,QuantaSing Group Limited American Depositary Shares,$1.97,-0.03,-1.50%,100692616.00,China,2023,19814,Real Estate,Other Consumer Services
QSI,Quantum-Si Incorporated Class A Common Stock,$2.645,0.005,0.189%,377475494.00,United States,2020,31767553,Industrials,Industrial Machinery/Components
QSIAW,Quantum-Si Incorporated Warrant,$0.895,-0.166,-15.646%,127728003.00,United States,2020,84049,Industrials,Industrial Machinery/Components
QSR,Restaurant Brands International Inc. Common Shares,$60.88,-1.66,-2.654%,19707312600.00,Canada,2014,1771031,Consumer Discretionary,Restaurants
QTI,QT Imaging Holdings Inc. Common Stock,$0.455,-0.014,-2.985%,9930591.00,United States,,182513,Health Care,Biotechnology: Electromedical & Electrotherapeutic Apparatus
QTRX,Quanterix Corporation Common Stock,$9.42,-2.31,-19.693%,362899151.00,United States,2017,2617041,Industrials,Biotechnology: Laboratory Analytical Instruments
QTTB,Q32 Bio Inc. Common Stock,$3.34,0.07,2.141%,40683541.00,United States,2018,347437,Health Care,Biotechnology: Pharmaceutical Preparations
QTWO,Q2 Holdings Inc. Common Stock,$88.95,-10.89,-10.907%,5372673220.00,United States,2014,1424648,Technology,Computer Software: Prepackaged Software
QUAD,Quad Graphics Inc Class A Common Stock,$6.27,-0.22,-3.39%,326785547.00,United States,,159057,Consumer Discretionary,Publishing
QUBT,Quantum Computing Inc. Common Stock,$8.98,-0.93,-9.384%,889796554.00,United States,,29776975,Technology,Computer Software: Prepackaged Software
QUIK,QuickLogic Corporation Common Stock,$8.85,-0.39,-4.221%,130157587.00,United States,1999,313028,Technology,Semiconductors
QURE,uniQure N.V. Ordinary Shares,$13.85,-2.07,-13.003%,675092489.00,Netherlands,2014,2017968,Health Care,Biotechnology: Pharmaceutical Preparations
QVCC,QVC Inc. 6.250% Senior Secured Notes due 2068,$11.84,-0.28,-2.31%,12.00,United States,2019,39571,Consumer Discretionary,Catalog/Specialty Distribution
QVCD,QVC Inc. 6.375% Senior Secured Notes due 2067,$11.935,-0.175,-1.445%,12.00,United States,2018,12665,Consumer Discretionary,Catalog/Specialty Distribution
QXO,QXO Inc. Common Stock,$15.65,0.37,2.421%,6407582552.00,United States,,847319,Technology,EDP Services
R,Ryder System Inc. Common Stock,$154.61,-3.82,-2.411%,6538489832.00,United States,,309430,Consumer Discretionary,Rental/Leasing Companies
RA,Brookfield Real Assets Income Fund Inc. Common Stock,$13.20,-0.16,-1.198%,0.00,United States,2016,287554,Finance,Investment Managers
RACE,Ferrari N.V. Common Shares,$429.29,-4.58,-1.056%,104639850477.00,Italy,2015,215168,Consumer Discretionary,Auto Manufacturing
RADX,Radiopharm Theranostics Limited American Depositary Shares,$5.35,1.32,32.754%,0.00,Australia,,498600,,
RAIL,FreightCar America Inc. Common Stock,$10.00,0.00,0.00%,188939720.00,United States,2005,114904,Industrials,Railroads
RAIN,Rain Enhancement Technologies Holdco Inc. Class A Common Stock,$5.4501,0.7501,15.96%,0.00,United States,,57385,Technology,Industrial Machinery/Components
RAINW,Rain Enhancement Technologies Holdco Inc. Warrants,$0.15,0.02,15.385%,0.00,United States,,187913,Technology,Industrial Machinery/Components
RAMP,LiveRamp Holdings Inc. Common Stock,$29.33,-0.92,-3.041%,1914202212.00,United States,2018,376766,Technology,EDP Services
RAND,Rand Capital Corporation Common Stock,$19.19,-0.23,-1.184%,49529793.00,United States,,10748,Finance,Finance: Consumer Services
RANGU,Range Capital Acquisition Corp. Units,$10.076,0.056,0.559%,0.00,United States,2024,1206,,
RANI,Rani Therapeutics Holdings Inc. Class A Common Stock,$1.25,-0.11,-8.088%,71610853.00,United States,2021,555021,Health Care,Biotechnology: Pharmaceutical Preparations
RAPP,Rapport Therapeutics Inc. Common Stock,$14.81,-1.88,-11.264%,541697328.00,United States,2024,314688,Health Care,Biotechnology: Pharmaceutical Preparations
RAPT,RAPT Therapeutics Inc. Common Stock,$1.32,-0.13,-8.966%,46144894.00,United States,2019,2356996,Health Care,Biotechnology: Pharmaceutical Preparations
RARE,Ultragenyx Pharmaceutical Inc. Common Stock,$42.07,-1.58,-3.62%,3884923355.00,United States,2014,833959,Health Care,Biotechnology: Pharmaceutical Preparations
RAVE,Rave Restaurant Group Inc. Common Stock,$2.47,-0.117,-4.523%,36337568.00,United States,,17159,Consumer Discretionary,Food Distributors
RAY,Raytech Holding Limited Ordinary Shares,$1.35,0.02,1.504%,23777662.00,Hong Kong,2024,458185,Consumer Discretionary,Consumer Electronics/Appliances
RAYA,Erayak Power Solution Group Inc. Class A Ordinary Shares,$1.33,0.05,3.906%,16558500.00,China,2022,28710,Consumer Discretionary,Metal Fabrications
RBA,RB Global Inc. Common Stock,$88.78,-1.58,-1.749%,16358070564.00,Canada,,541985,Consumer Discretionary,Business Services
RBB,RBB Bancorp Common Stock,$18.73,-1.21,-6.068%,331397682.00,United States,2017,44799,Finance,Major Banks
RBBN,Ribbon Communications Inc. Common Stock,$3.95,-0.06,-1.496%,692765564.00,United States,,288944,Technology,EDP Services
RBC,RBC Bearings Incorporated Common Stock,$294.36,-3.49,-1.172%,9245659210.00,United States,2022,96082,Industrials,Metal Fabrications
RBCAA,Republic Bancorp Inc. Class A Common Stock,$64.80,-1.85,-2.776%,1260090302.00,United States,1998,18955,Finance,Major Banks
RBKB,Rhinebeck Bancorp Inc. Common Stock,$9.52,-0.1301,-1.348%,105554019.00,United States,2019,13280,Finance,Banks
RBLX,Roblox Corporation Class A Common Stock,$61.82,-0.23,-0.371%,40567784495.00,United States,2021,6017062,Technology,Computer Software: Prepackaged Software
RBOT,Vicarious Surgical Inc. Class A Common Stock,$12.46,-2.12,-14.54%,73616409.00,Hong Kong,2020,72641,Health Care,Industrial Specialties
RBRK,Rubrik Inc. Class A Common Stock,$63.46,0.27,0.427%,11755567233.00,United States,2024,1900485,Technology,Computer Software: Prepackaged Software
RC,Ready Capital Corporation Common Stock,$6.56,-0.10,-1.502%,1105561418.00,United States,2013,1899525,Real Estate,Real Estate Investment Trusts
RC^C,Ready Capital Corporation 6.25% Series C Cumulative Convertible Preferred Stock,$17.66,-0.29,-1.616%,,United States,,1243,,
RC^E,Ready Capital Corporation 6.50% Series E Cumulative Redeemable Preferred Stock,$18.05,-0.25,-1.366%,,United States,,13219,,
RCAT,Red Cat Holdings Inc. Common Stock,$10.03,-1.80,-15.216%,804012643.00,United States,,10254525,Technology,Computer Software: Prepackaged Software
RCB,Ready Capital Corporation 6.20% Senior Notes due 2026,$24.4241,-0.1359,-0.553%,4116210768.00,United States,2019,9070,Real Estate,Real Estate Investment Trusts
RCC,Ready Capital Corporation 5.75% Senior Notes due 2026,$24.45,-0.04,-0.163%,4120575713.00,United States,2021,4739,Real Estate,Real Estate Investment Trusts
RCD,Ready Capital Corporation 9.00% Senior Notes due 2029,$24.86,-0.07,-0.281%,0.00,United States,2024,125501,Real Estate,Real Estate Investment Trusts
RCEL,Avita Medical Inc. Common Stock,$9.14,0.20,2.237%,239629129.00,United States,,583742,Health Care,Medical/Dental Instruments
RCG,RENN Fund Inc Common Stock,$2.55,0.03,1.19%,0.00,United States,,14666,Finance,Investment Managers
RCI,Rogers Communication Inc. Common Stock,$29.00,-1.53,-5.011%,15499561705.00,Canada,,972778,Telecommunications,Cable & Other Pay Television Services
RCKT,Rocket Pharmaceuticals Inc. Common Stock,$11.14,-0.65,-5.513%,1015489927.00,United States,2015,1846436,Health Care,Biotechnology: Pharmaceutical Preparations
RCKTW,Rocket Pharmaceuticals Inc. Warrant,$0.0542,-0.0008,-1.455%,4940714.00,United States,,37793,Health Care,Biotechnology: Pharmaceutical Preparations
RCKY,Rocky Brands Inc. Common Stock,$22.28,-0.32,-1.416%,166070976.00,United States,1993,40389,Consumer Discretionary,Shoe Manufacturing
RCL,Royal Caribbean Cruises Ltd. Common Stock,$226.95,-0.27,-0.119%,61021235718.00,United States,1993,2498698,Consumer Discretionary,Marine Transportation
RCMT,RCM Technologies Inc. Common Stock,$19.91,-0.31,-1.533%,151256827.00,United States,,39997,Consumer Discretionary,Professional Services
RCON,Recon Technology Ltd. Class A Ordinary Shares,$2.27,-0.15,-6.198%,34249667.00,China,2009,8451,Energy,Oilfield Services/Equipment
RCS,PIMCO Strategic Income Fund Inc.,$6.24,-0.14,-2.194%,0.00,United States,1994,248464,Finance,Investment Managers
RCUS,Arcus Biosciences Inc. Common Stock,$14.20,-0.72,-4.826%,1299464848.00,United States,2018,573389,Health Care,Biotechnology: Pharmaceutical Preparations
RDAC,Rising Dragon Acquisition Corp. Ordinary Shares,$10.03,0.01,0.10%,0.00,China,2024,22010,,
RDCM,Radcom Ltd. Ordinary Shares,$13.38,1.27,10.487%,204817454.00,Israel,1997,187013,Technology,Computer peripheral equipment
RDDT,Reddit Inc. Class A Common Stock,$167.08,-4.93,-2.866%,29335616516.00,United States,2024,3751694,Technology,EDP Services
RDFN,Redfin Corporation Common Stock,$7.34,-0.08,-1.078%,910016679.00,United States,2017,5006353,Finance,Real Estate
RDHL,Redhill Biopharma Ltd. American Depositary Shares,$5.8603,-0.3997,-6.385%,7504343.00,Israel,,19527,Health Care,Biotechnology: Pharmaceutical Preparations
RDI,Reading International Inc Class A Common Stock,$1.40,-0.03,-2.098%,31396658.00,United States,,57601,Consumer Discretionary,Movies/Entertainment
RDIB,Reading International Inc Class B Common Stock,$6.42,-0.43,-6.277%,143976101.00,United States,,6859,Consumer Discretionary,Movies/Entertainment
RDN,Radian Group Inc. Common Stock,$30.60,-1.04,-3.287%,4557336520.00,United States,,1854540,Finance,Property-Casualty Insurers
RDNT,RadNet Inc. Common Stock,$68.78,-3.47,-4.803%,5091558971.00,United States,,525175,Health Care,Medical Specialities
RDUS,Radius Recycling Inc. Class A Common Stock,$10.96,-0.45,-3.944%,308583009.00,United States,,583358,Consumer Discretionary,Industrial Specialties
RDVT,Red Violet Inc. Common Stock ,$34.18,-1.10,-3.118%,471398665.00,United States,,71724,Technology,Computer Software: Prepackaged Software
RDW,Redwire Corporation Common Stock,$15.51,-0.70,-4.318%,1032048909.00,United States,2021,950372,Industrials,Military/Government/Technical
RDWR,Radware Ltd. Ordinary Shares,$21.37,-0.40,-1.837%,891104980.00,Israel,1999,123231,Consumer Discretionary,Business Services
RDY,Dr. Reddy's Laboratories Ltd Common Stock,$15.42,-0.39,-2.467%,12866227957.00,India,,3905414,Health Care,Biotechnology: Pharmaceutical Preparations
RDZN,Roadzen Inc. Ordinary Shares,$1.71,-0.15,-8.065%,117033818.00,United States,2022,274111,Finance,Specialty Insurers
