Symbol,Name,Last Sale,Net Change,% Change,Market Cap,Country,IPO Year,Volume,Sector,Industry
A,Agilent Technologies Inc. Common Stock,$137.47,0.47,0.343%,39260786166.00,United States,1999,1369873,Industrials,Biotechnology: Laboratory Analytical Instruments
AA,Alcoa Corporation Common Stock ,$35.91,-0.09,-0.25%,9277521873.00,United States,2016,2942553,Industrials,Aluminum
AACG,ATA Creativity Global American Depositary Shares,$0.9462,-0.0329,-3.36%,30278523.00,China,2008,20877,Real Estate,Other Consumer Services
AACT,Ares Acquisition Corporation II Class A Ordinary Shares,$10.98,0.00,0.00%,0.00,,2023,14192,Finance,Blank Checks
AADI,Aadi Bioscience Inc. Common Stock,$3.60,0.00,0.00%,88730611.00,United States,,566614,Health Care,Biotechnology: Pharmaceutical Preparations
AAL,American Airlines Group Inc. Common Stock,$18.38,0.78,4.432%,12078067706.00,United States,,43776114,Consumer Discretionary,Air Freight/Delivery Services
AAM,AA Mission Acquisition Corp. Class A Ordinary Shares,$10.11,-0.01,-0.099%,0.00,,2024,619,,
AAME,Atlantic American Corporation Common Stock,$1.485,-0.035,-2.303%,30293641.00,United States,,4025,Finance,Life Insurance
AAMI,Acadian Asset Management Inc. Common Stock,$24.04,-1.00,-3.994%,897123230.00,United Kingdom,2014,165013,Finance,Investment Managers
AAOI,Applied Optoelectronics Inc. Common Stock,$31.60,-0.77,-2.379%,1424471215.00,United States,2013,1714672,Technology,Semiconductors
AAON,AAON Inc. Common Stock,$122.07,1.88,1.564%,9921803824.00,United States,,522847,Industrials,Industrial Machinery/Components
AAP,Advance Auto Parts Inc.,$46.20,0.67,1.472%,2759734501.00,United States,,1787066,Consumer Discretionary,Auto & Home Supply Stores
AAPL,Apple Inc. Common Stock,$236.85,-5.85,-2.41%,3580182677550.00,United States,1980,61629440,Technology,Computer Manufacturing
AAT,American Assets Trust Inc. Common Stock,$23.56,-0.79,-3.244%,1434841295.00,United States,2011,399711,Real Estate,Real Estate Investment Trusts
AB,AllianceBernstein Holding L.P.  Units,$35.43,-1.44,-3.906%,4019014699.00,United States,,336297,Finance,Investment Managers
ABAT,American Battery Technology Company Common Stock,$2.04,-0.08,-3.774%,152024205.00,United States,,4095198,Basic Materials,Metal Mining
ABBV,AbbVie Inc. Common Stock,$175.17,-3.33,-1.866%,309549970380.00,United States,2012,5310775,Health Care,Biotechnology: Pharmaceutical Preparations
ABCB,Ameris Bancorp Common Stock,$59.43,-1.77,-2.892%,4104635764.00,United States,1994,424133,Finance,Major Banks
ABCL,AbCellera Biologics Inc. Common Shares,$2.92,-0.11,-3.63%,860423353.00,Canada,2020,3357127,Health Care,Pharmaceuticals and Biotechnology
ABEO,Abeona Therapeutics Inc. Common Stock,$5.55,-0.41,-6.879%,241264217.00,United States,,361769,Health Care,Biotechnology: Pharmaceutical Preparations
ABEV,Ambev S.A. American Depositary Shares (Each representing 1 Common Share),$1.78,-0.06,-3.261%,28041823246.00,Brazil,2013,44184434,Consumer Staples,Beverages (Production/Distribution)
ABG,Asbury Automotive Group Inc Common Stock,$237.80,-4.19,-1.731%,4657897750.00,United States,2002,127111,Consumer Discretionary,Retail-Auto Dealers and Gas Stations
ABL,Abacus Life Inc. Class A Common Stock,$6.92,-0.47,-6.36%,516777081.00,United States,2020,617468,Finance,Investment Managers
ABLLL,Abacus Life Inc. 9.875% Fixed Rate Senior Notes due 2028,$25.63,-4.25,-14.224%,1913314024.00,United States,,31994,Finance,Investment Managers
ABLLW,Abacus Life Inc. Warrant,$1.00,0.00,0.00%,74678769.00,United States,2020,22484,Finance,Investment Managers
ABLV,Able View Global Inc. Class B Ordinary Shares,$0.956,-0.074,-7.184%,40495427.00,China,,4202,Consumer Discretionary,Other Consumer Services
ABLVW,Able View Global Inc. Warrant,$0.0206,0.0006,3.00%,872600.00,China,,3559,Consumer Discretionary,Other Consumer Services
ABM,ABM Industries Incorporated Common Stock,$50.42,-0.55,-1.079%,3136293966.00,United States,,310848,Finance,Diversified Commercial Services
ABNB,Airbnb Inc. Class A Common Stock,$129.63,-1.17,-0.894%,82181743693.00,United States,2020,4321805,Finance,Diversified Commercial Services
ABOS,Acumen Pharmaceuticals Inc. Common Stock,$1.65,-0.05,-2.941%,99131634.00,United States,2021,357830,Health Care,Biotechnology: Biological Products (No Diagnostic Substances)
ABP,Abpro Holdings Inc Common Stock,$1.365,0.075,5.814%,70322896.00,United States,2022,53668,Health Care,Biotechnology: Pharmaceutical Preparations
ABPWW,Abpro Holdings Inc. Warrant,$0.0635,-0.0195,-23.494%,3271431.00,United States,2022,24487,Health Care,Biotechnology: Pharmaceutical Preparations
ABR,Arbor Realty Trust Common Stock,$12.98,-0.51,-3.781%,2448141925.00,United States,2004,4545570,Real Estate,Real Estate Investment Trusts
ABR^D,Arbor Realty Trust 6.375% Series D Cumulative Redeemable Preferred Stock Liquidation Preference $25.00 per Share,$18.63,-0.365,-1.922%,,United States,,20304,,
ABR^E,Arbor Realty Trust 6.25% Series E Cumulative Redeemable Preferred Stock,$18.30,-0.57,-3.021%,,United States,,5603,,
ABR^F,Arbor Realty Trust 6.25% Series F Fixed-to-Floating Rate Cumulative Redeemable Preferred Stock Liquidation Preference $25.00 per share,$22.80,-0.3824,-1.65%,,United States,,19857,,
ABSI,Absci Corporation Common Stock,$2.855,-0.365,-11.335%,327913192.00,United States,2021,8293771,Health Care,Biotechnology: Commercial Physical & Biological Resarch
ABT,Abbott Laboratories Common Stock,$112.31,-1.94,-1.698%,194796664972.00,United States,,5107864,Health Care,Biotechnology: Pharmaceutical Preparations
ABTS,Abits Group Inc Ordinary Shares,$0.4501,0.0036,0.806%,16003160.00,China,,52199,Technology,Computer Software: Programming Data Processing
ABUS,Arbutus Biopharma Corporation Common Stock,$3.29,-0.06,-1.791%,623427644.00,Canada,,835965,Health Care,Biotechnology: Pharmaceutical Preparations
ABVC,ABVC BioPharma Inc. Common Stock,$0.554,0.02,3.745%,7188423.00,United States,,154384,Health Care,Biotechnology: Pharmaceutical Preparations
ABVE,Above Food Ingredients Inc. Common Stock,$0.4502,0.0391,9.511%,12517634.00,Canada,,79682,Consumer Staples,Packaged Foods
ABVEW,Above Food Ingredients Inc. Warrants,$0.0279,-0.0011,-3.793%,775749.00,Canada,,65914,Consumer Staples,Packaged Foods
ABVX,Abivax SA American Depositary Shares,$6.38,-0.30,-4.491%,401413516.00,France,2023,211089,Health Care,Biotechnology: Pharmaceutical Preparations
AC,Associated Capital Group Inc. Common Stock,$34.3363,-0.8637,-2.454%,729204639.00,United States,2015,3144,Finance,Investment Bankers/Brokers/Service
ACA,Arcosa Inc. Common Stock ,$92.29,-2.70,-2.842%,4501612533.00,United States,2018,225506,Industrials,Metal Fabrications
ACAD,ACADIA Pharmaceuticals Inc. Common Stock,$17.26,-0.34,-1.932%,2871924039.00,United States,1985,2375369,Health Care,Biotechnology: Pharmaceutical Preparations
ACB,Aurora Cannabis Inc. Common Shares,$4.13,-0.29,-6.561%,225749009.00,Canada,,781592,Health Care, Medicinal Chemicals and Botanical Products 
ACCD,Accolade Inc. Common Stock,$6.83,-0.03,-0.437%,550068256.00,United States,2020,11364550,Consumer Discretionary,Business Services
ACCO,Acco Brands Corporation Common Stock,$5.02,-0.09,-1.761%,466262660.00,United States,,673203,Consumer Discretionary,Publishing
ACDC,ProFrac Holding Corp. Class A Common Stock,$7.79,0.16,2.097%,1247542030.00,United States,2022,312767,Energy,Oilfield Services/Equipment
ACEL,Accel Entertainment Inc. ,$10.26,-0.25,-2.379%,844843869.00,United States,2017,194674,Consumer Discretionary,Services-Misc. Amusement & Recreation
ACET,Adicet Bio Inc. Common Stock ,$0.9171,-0.0429,-4.469%,75569920.00,United States,2018,408639,Health Care,Biotechnology: Pharmaceutical Preparations
ACGL,Arch Capital Group Ltd. Common Stock,$90.17,-2.49,-2.687%,33925730229.00,Bermuda,,2896396,Finance,Property-Casualty Insurers
ACGLN,Arch Capital Group Ltd. Depositary Shares each Representing a 1/1000th Interest in a 4.550% Non-Cumulative Preferred Share Series G,$17.63,-0.43,-2.381%,6633144327.00,Bermuda,,69223,Finance,Property-Casualty Insurers
ACGLO,Arch Capital Group Ltd. Depositary Shares Each Representing 1/1000th Interest in a Share of 5.45% Non-Cumulative Preferred Shares Series F,$21.13,-0.51,-2.357%,7949990903.00,Bermuda,,31502,Finance,Property-Casualty Insurers
ACHC,Acadia Healthcare Company Inc. Common Stock,$44.92,-0.20,-0.443%,4172410012.00,United States,,1930656,Health Care,Medical Specialities
ACHL,Achilles Therapeutics plc American Depositary Shares,$1.185,-0.005,-0.42%,48683293.00,United Kingdom,2021,278983,Health Care,Biotechnology: Biological Products (No Diagnostic Substances)
ACHR,Archer Aviation Inc. Class A Common Stock,$8.97,-1.51,-14.408%,3814695877.00,United States,2020,37565560,Industrials,Aerospace
ACHV,Achieve Life Sciences Inc. Common Shares,$3.38,-0.14,-3.977%,116238017.00,United States,,239108,Health Care,Biotechnology: In Vitro & In Vivo Diagnostic Substances
ACI,Albertsons Companies Inc. Class A Common Stock,$19.95,0.07,0.352%,11558617574.00,United States,2020,7152307,Consumer Staples,Food Chains
ACIC,American Coastal Insurance Corporation Common Stock,$11.85,-0.47,-3.815%,571228800.00,United States,,288693,Finance,Property-Casualty Insurers
ACIU,AC Immune SA Common Stock,$2.72,-0.08,-2.857%,269818095.00,Switzerland,2016,73276,Health Care,Biotechnology: Pharmaceutical Preparations
ACIW,ACI Worldwide Inc. Common Stock,$51.34,-0.78,-1.497%,5384982880.00,United States,,737371,Technology,Computer Software: Prepackaged Software
ACLS,Axcelis Technologies Inc. Common Stock,$69.44,-3.66,-5.007%,2257224348.00,United States,2000,843750,Technology,Industrial Machinery/Components
ACLX,Arcellx Inc. Common Stock,$69.08,-3.18,-4.401%,3735478204.00,United States,2022,1602592,Health Care,Biotechnology: Biological Products (No Diagnostic Substances)
ACM,AECOM Common Stock,$105.87,-1.45,-1.351%,14023932342.00,United States,2007,1072889,Consumer Discretionary,Military/Government/Technical
ACMR,ACM Research Inc. Class A Common Stock,$15.62,0.21,1.363%,978246970.00,United States,2017,1190628,Technology,Industrial Machinery/Components
ACN,Accenture plc Class A Ordinary Shares (Ireland),$349.79,-7.94,-2.22%,218894276435.00,Ireland,2001,2309778,Consumer Discretionary,Business Services
ACNB,ACNB Corporation Common Stock,$36.69,-1.41,-3.701%,313649051.00,United States,,20203,Finance,Major Banks
ACNT,Ascent Industries Co. Common Stock,$11.29,-0.23,-1.997%,113949586.00,United States,,54109,Industrials,Steel/Iron Ore
ACOG,Alpha Cognition Inc. Common Stock,$6.095,0.375,6.556%,94663164.00,Canada,,176871,,
ACON,Aclarion Inc. Common Stock,$0.1173,-0.0211,-15.246%,1223575.00,United States,2022,5472430,Health Care,Medical Specialities
ACONW,Aclarion Inc. Warrant,$0.036,0.0089,32.841%,375522.00,United States,2022,7226,Health Care,Medical Specialities
ACP,abrdn Income Credit Strategies Fund Common Shares,$5.93,-0.02,-0.336%,0.00,United States,2011,742922,Finance,Investment Managers
ACP^A,abrdn Income Credit Strategies Fund 5.250% Series A Perpetual Preferred Stock,$21.8099,0.1599,0.739%,,United States,,2848,,
ACR,ACRES Commercial Realty Corp. Common Stock,$17.39,-0.03,-0.172%,134544813.00,United States,,14254,Real Estate,Real Estate Investment Trusts
ACR^C,ACRES Commercial Realty Corp. 8.625% Fixed-to-Floating Series C Cumulative Redeemable Preferred Stock ,$24.55,0.02,0.082%,,United States,,4427,,
ACR^D,ACRES Commercial Realty Corp. 7.875% Series D Cumulative Redeemable Preferred Stock,$22.02,-0.1963,-0.884%,,United States,,2270,,
ACRE,Ares Commercial Real Estate Corporation Common Stock,$5.44,-0.27,-4.729%,296709448.00,United States,2012,883925,Real Estate,Real Estate Investment Trusts
ACRS,Aclaris Therapeutics Inc. Common Stock,$2.47,0.01,0.407%,176434427.00,United States,2015,1661360,Health Care,Biotechnology: Pharmaceutical Preparations
ACRV,Acrivon Therapeutics Inc. Common Stock,$5.47,-0.63,-10.328%,170315539.00,United States,2022,41944,Health Care,Biotechnology: Pharmaceutical Preparations
ACT,Enact Holdings Inc. Common Stock,$31.15,-0.71,-2.228%,4784305574.00,United States,2021,281147,Finance,Specialty Insurers
ACTG,Acacia Research Corporation (Acacia Tech) Common Stock,$4.22,-0.04,-0.939%,410893656.00,United States,,176094,Miscellaneous,Multi-Sector Companies
ACTU,Actuate Therapeutics Inc. Common stock,$8.30,0.30,3.75%,162112579.00,United States,2024,46749,Health Care,Biotechnology: Pharmaceutical Preparations
ACU,Acme United Corporation. Common Stock,$35.11,-0.80,-2.228%,131362415.00,United States,1988,8075,Consumer Discretionary,Industrial Machinery/Components
ACV,Virtus Diversified Income & Convertible Fund Common Shares of Beneficial Interest,$22.00,-0.09,-0.407%,227984988.00,United States,2015,22791,Finance,Finance/Investors Services
ACVA,ACV Auctions Inc. Class A Common Stock,$20.75,-0.39,-1.845%,3478529232.00,United States,2021,1316993,Consumer Discretionary,Business Services
ACXP,Acurx Pharmaceuticals Inc. Common Stock,$0.8082,0.0572,7.617%,13652557.00,United States,2021,1138697,Health Care,Biotechnology: Pharmaceutical Preparations
ADAG,Adagene Inc. American Depositary Shares,$1.935,-0.015,-0.769%,85365758.00,China,2021,31397,Health Care,Biotechnology: Pharmaceutical Preparations
ADAP,Adaptimmune Therapeutics plc American Depositary Shares,$0.62,0.0001,0.016%,158647588.00,United Kingdom,2015,1798888,Health Care,Biotechnology: Biological Products (No Diagnostic Substances)
ADBE,Adobe Inc. Common Stock,$405.92,-13.66,-3.256%,178685984000.00,United States,1986,5547724,Technology,Computer Software: Prepackaged Software
ADC,Agree Realty Corporation Common Stock,$68.36,-1.33,-1.908%,7076810200.00,United States,,761667,Real Estate,Real Estate Investment Trusts
ADC^A,Agree Realty Corporation Depositary Shares each representing 1/1000th of a 4.250% Series A Cumulative Redeemable Preferred Stock,$17.32,-0.38,-2.147%,,United States,,62886,,
ADCT,ADC Therapeutics SA Common Shares,$1.88,-0.04,-2.083%,181776480.00,Switzerland,2020,764295,Health Care,Biotechnology: Pharmaceutical Preparations
ADD,Color Star Technology Co. Ltd. Class A Ordinary Shares,$1.80,0.14,8.434%,1106347.00,United States,,1507468,Consumer Discretionary,Engineering & Construction
ADEA,Adeia Inc. Common Stock,$13.09,-0.51,-3.75%,1430278025.00,United States,2003,574458,Technology,Computer Software: Prepackaged Software
ADGM,Adagio Medical Holdings Inc Common Stock,$0.9529,-0.0521,-5.184%,13850531.00,United States,,338219,Health Care,Medical/Dental Instruments
ADI,Analog Devices Inc. Common Stock,$212.37,-8.07,-3.661%,105398562884.00,United States,,4107874,Technology,Semiconductors
ADIL,Adial Pharmaceuticals Inc Common Stock,$1.02,0.00,0.00%,6533897.00,United States,2018,91262,Health Care,Biotechnology: Pharmaceutical Preparations
ADM,Archer-Daniels-Midland Company Common Stock,$51.09,1.25,2.508%,24448277537.00,United States,,4497546,Consumer Staples,Packaged Foods
ADMA,ADMA Biologics Inc Common Stock,$18.56,0.00,0.00%,4387403096.00,United States,,2081388,Health Care,Biotechnology: Biological Products (No Diagnostic Substances)
ADN,Advent Technologies Holdings Inc. Class A Common Stock,$5.47,-0.17,-3.014%,14421699.00,United States,2018,52944,Miscellaneous,Industrial Machinery/Components
ADNT,Adient plc Ordinary Shares ,$16.66,-0.36,-2.115%,1413880272.00,United States,2016,933755,Consumer Discretionary,Auto Parts:O.E.M.
ADNWW,Advent Technologies Holdings Inc. Warrant,$0.0131,-0.0002,-1.504%,34538.00,United States,2018,92809,Miscellaneous,Industrial Machinery/Components
ADP,Automatic Data Processing Inc. Common Stock,$286.85,-5.04,-1.727%,116879012052.00,United States,,2292438,Technology,EDP Services
ADPT,Adaptive Biotechnologies Corporation Common Stock,$6.50,-0.19,-2.84%,959266659.00,United States,2019,1288045,Health Care,Biotechnology: Biological Products (No Diagnostic Substances)
ADSE,ADS-TEC ENERGY PLC Ordinary Shares,$15.21,-0.09,-0.588%,769394245.00,Ireland,,154037,Consumer Discretionary,Industrial Specialties
ADSEW,ADS-TEC ENERGY PLC Warrant,$3.80,-0.11,-2.813%,192222099.00,Ireland,,37108,Consumer Discretionary,Industrial Specialties
ADSK,Autodesk Inc. Common Stock,$284.96,-11.41,-3.85%,61266400000.00,United States,,2352179,Technology,Computer Software: Prepackaged Software
ADT,ADT Inc. Common Stock,$6.87,-0.16,-2.276%,6231182017.00,United States,2018,3667900,Consumer Discretionary,Diversified Commercial Services
ADTN,ADTRAN Holdings Inc. Common Stock,$10.17,-0.32,-3.051%,805961740.00,United States,1994,1036967,Utilities,Telecommunications Equipment
ADTX,Aditxt Inc. Common Stock,$0.1699,0.0017,1.011%,2418392.00,United States,2020,11498130,Health Care,Biotechnology: Pharmaceutical Preparations
ADUR,Aduro Clean Technologies Inc. Common Stock,$5.81,0.26,4.685%,165224687.00,Canada,,39534,,
ADUS,Addus HomeCare Corporation Common Stock,$125.34,-1.08,-0.854%,2272804634.00,United States,2009,146160,Health Care,Medical/Nursing Services
ADV,Advantage Solutions Inc. Class A Common Stock,$2.38,-0.25,-9.506%,763393923.00,United States,2019,381252,Consumer Discretionary,Business Services
ADVM,Adverum Biotechnologies Inc. Common Stock,$4.27,-0.25,-5.531%,88826517.00,United States,2014,218131,Health Care,Biotechnology: Biological Products (No Diagnostic Substances)
ADVWW,Advantage Solutions Inc. Warrant,$0.0145,-0.001,-6.452%,4650929.00,United States,2019,49274,Consumer Discretionary,Business Services
ADX,Adams Diversified Equity Fund Inc.,$20.22,-0.24,-1.173%,0.00,United States,,450987,Finance,Investment Managers
ADXN,Addex Therapeutics Ltd American Depositary Shares,$7.52,-0.57,-7.046%,7845578.00,Switzerland,,18831,Health Care,Biotechnology: Pharmaceutical Preparations
AE,Adams Resources & Energy Inc. Common Stock,$37.25,-0.19,-0.507%,96025732.00,United States,1980,10800,Energy,Oil Refining/Marketing
AEE,Ameren Corporation Common Stock,$88.04,-1.20,-1.345%,23500320607.00,United States,,1095624,Utilities,Power Generation
AEF,abrdn Emerging Markets Equity Income Fund Inc. Common Stock,$5.13,-0.12,-2.286%,550769625.00,United States,,133867,Finance,Finance/Investors Services
AEFC,Aegon Funding Company LLC 5.10% Subordinated Notes due 2049,$20.15,-0.32,-1.563%,0.00,United States,2019,56850,,
AEG,Aegon Ltd. New York Registry Shares,$5.94,-0.05,-0.835%,13094647743.00,Netherlands,,7809311,Finance,Life Insurance
AEHL,Antelope Enterprise Holdings Limited Class A Ordinary Shares,$0.183,-0.0005,-0.272%,1623324.00,China,,3753267,Industrials,Building Materials
AEHR,Aehr Test Systems Common Stock,$16.39,-0.07,-0.425%,485649763.00,United States,1997,806711,Industrials,Electrical Products
AEI,Alset Inc. Common Stock (TX),$0.925,0.00,0.00%,8542485.00,United States,2020,182122,Finance,Real Estate
AEIS,Advanced Energy Industries Inc. Common Stock,$118.36,-0.31,-0.261%,4458984210.00,United States,1995,167668,Technology,Industrial Machinery/Components
AEM,Agnico Eagle Mines Limited Common Stock,$84.30,0.94,1.128%,42310798962.00,Canada,,2239548,Basic Materials,Precious Metals
AEMD,Aethlon Medical Inc. Common Stock,$0.6669,-0.0096,-1.419%,9311256.00,United States,,692067,Health Care,Medical/Dental Instruments
AENT,Alliance Entertainment Holding Corporation Class A Common Stock,$7.56,-1.72,-18.534%,385237717.00,United States,,110443,Consumer Discretionary,Durable Goods
AENTW,Alliance Entertainment Holding Corporation Warrants,$0.3755,-0.1245,-24.90%,19134492.00,United States,,37653,Consumer Discretionary,Durable Goods
AEO,American Eagle Outfitters Inc. Common Stock,$16.23,-0.29,-1.755%,3117811938.00,United States,,5985178,Consumer Discretionary,Clothing/Shoe/Accessory Stores
AEON,AEON Biopharma Inc. Class A Common Stock,$0.1856,-0.0045,-2.367%,7418561.00,United States,,8775496,Health Care,Biotechnology: Pharmaceutical Preparations
AEP,American Electric Power Company Inc. Common Stock,$93.51,1.25,1.355%,49800184476.00,United States,,7725244,Utilities,Electric Utilities: Central
AER,AerCap Holdings N.V. Ordinary Shares,$94.11,-2.04,-2.122%,19056632040.00,Netherlands,2006,1257792,Consumer Discretionary,Diversified Commercial Services
AERT,Aeries Technology Inc. Class A Ordinary Share,$0.81,0.029,3.713%,36045346.00,United States,2021,74998,Consumer Discretionary,Professional Services
AERTW,Aeries Technology Inc. Warrant,$0.05,-0.0088,-14.966%,2225021.00,United States,2021,2184,Consumer Discretionary,Professional Services
AES,The AES Corporation Common Stock,$12.02,-0.38,-3.065%,8546545057.00,United States,,16106007,Utilities,Electric Utilities: Central
AESI,Atlas Energy Solutions Inc. Common Stock,$21.76,-0.17,-0.775%,2398318351.00,United States,2023,616765,Industrials,Mining & Quarrying of Nonmetallic Minerals (No Fuels)
AEVA,Aeva Technologies Inc. Common Stock,$4.49,-0.04,-0.883%,241933776.00,United States,2020,438060,Consumer Discretionary,Auto Parts:O.E.M.
AEYE,AudioEye Inc. Common Stock,$15.03,0.92,6.52%,183037294.00,United States,,378914,Technology,Computer Software: Prepackaged Software
AFB,AllianceBernstein National Municipal Income Fund Inc,$10.71,-0.13,-1.199%,0.00,United States,2002,91744,Finance,Trusts Except Educational Religious and Charitable
AFBI,Affinity Bancshares Inc. Common Stock (MD),$17.44,-0.21,-1.19%,111832779.00,United States,2017,113070,Finance,Banks
AFCG,Advanced Flower Capital Inc. Common Stock,$8.22,-0.25,-2.952%,180451005.00,United States,2021,332320,Finance,Real Estate
AFG,American Financial Group Inc. Common Stock,$129.86,-2.40,-1.815%,10899313034.00,United States,,394316,Finance,Property-Casualty Insurers
AFGB,American Financial Group Inc. 5.875% Subordinated Debentures due 2059,$22.31,-0.27,-1.196%,1872506344.00,United States,2019,17103,Finance,Property-Casualty Insurers
AFGC,American Financial Group Inc. 5.125% Subordinated Debentures due 2059,$19.60,-0.45,-2.244%,1645052637.00,United States,2019,10587,Finance,Property-Casualty Insurers
AFGD,American Financial Group Inc. 5.625% Subordinated Debentures due 2060,$21.26,-0.48,-2.208%,1784378524.00,United States,2020,20025,Finance,Property-Casualty Insurers
AFGE,American Financial Group Inc. 4.500% Subordinated Debentures due 2060,$17.63,-0.31,-1.728%,1479708061.00,United States,2020,8845,Finance,Property-Casualty Insurers
AFJK,Aimei Health Technology Co. Ltd Ordinary Share,$10.72,-0.03,-0.279%,0.00,United States,2024,2525,,
AFJKR,Aimei Health Technology Co. Ltd Right,$0.16,-0.02,-11.111%,0.00,United States,2024,200,,
AFL,AFLAC Incorporated Common Stock,$100.99,-2.58,-2.491%,56102814833.00,United States,,2176280,Finance,Accident &Health Insurance
AFMD,Affimed N.V.,$1.18,-0.01,-0.84%,17968406.00,Germany,2014,192181,Health Care,Biotechnology: Pharmaceutical Preparations
AFRI,Forafric Global PLC Ordinary Shares,$9.85,-0.17,-1.697%,264760140.00,Gibraltar,,32471,Consumer Staples,Packaged Foods
AFRIW,Forafric Global PLC Warrants,$1.23,0.17,16.038%,33061418.00,Gibraltar,,9117,Consumer Staples,Packaged Foods
AFRM,Affirm Holdings Inc. Class A Common Stock,$55.31,-3.36,-5.727%,17370442725.00,United States,2021,7665571,Finance,Finance: Consumer Services
AFYA,Afya Limited Class A Common Shares,$14.95,-0.13,-0.862%,1344742827.00,Brazil,2019,110501,Real Estate,Other Consumer Services
AG,First Majestic Silver Corp. Ordinary Shares (Canada),$5.85,-0.03,-0.51%,1764401278.00,Canada,,13832403,Basic Materials,Precious Metals
AGAE,Allied Gaming & Entertainment Inc. Common Stock,$0.95,0.05,5.556%,41900713.00,United States,2017,6795,Consumer Discretionary,Services-Misc. Amusement & Recreation
AGCO,AGCO Corporation Common Stock,$90.85,0.62,0.687%,6781523779.00,United States,,905858,Industrials,Industrial Machinery/Components
AGD,abrdn Global Dynamic Dividend Fund Common Shares of Beneficial Interest,$9.83,-0.08,-0.807%,0.00,United States,2006,109559,Finance,Trusts Except Educational Religious and Charitable
AGEN,Agenus Inc. Common Stock,$3.115,-0.285,-8.382%,73074564.00,United States,2000,294316,Health Care,Biotechnology: Biological Products (No Diagnostic Substances)
AGFY,Agrify Corporation Common Stock,$25.15,-0.9473,-3.63%,38473137.00,United States,2021,10137,Consumer Staples,Farming/Seeds/Milling
AGI,Alamos Gold Inc. Class A Common Shares,$19.51,0.18,0.931%,8188691527.00,Canada,2015,2247814,Basic Materials,Precious Metals
AGIO,Agios Pharmaceuticals Inc. Common Stock,$34.42,-1.48,-4.123%,1962979312.00,United States,2013,1255976,Health Care,Biotechnology: Pharmaceutical Preparations
AGL,agilon health inc. Common Stock,$2.43,0.24,10.959%,1001203363.00,United States,2021,6907777,Health Care,Misc Health and Biotechnology Services
AGM,Federal Agricultural Mortgage Corporation Common Stock,$182.78,-4.98,-2.652%,1989707072.00,United States,,49483,Finance,Finance Companies
AGM^D,Federal Agricultural Mortgage Corporation 5.700% Non-Cumulative Preferred Stock Series D,$21.71,-0.2006,-0.916%,,United States,,6242,,
AGM^E,Federal Agricultural Mortgage Corporation 5.750% Non-Cumulative Preferred Stock Series E,$22.31,-0.19,-0.844%,,United States,,1217,,
AGM^F,Federal Agricultural Mortgage Corporation 5.250% Non-Cumulative Preferred Stock Series F,$20.55,0.1113,0.545%,,United States,,35931,,
AGM^G,Federal Agricultural Mortgage Corporation 4.875% Non-Cumulative Preferred Stock Series G,$18.9483,-0.0617,-0.325%,,United States,,14513,,
AGMH,AGM Group Holdings Inc. Class A Ordinary Shares,$1.34,-0.03,-2.19%,35315488.00,Hong Kong,2018,2997,Technology,EDP Services
AGNC,AGNC Investment Corp. Common Stock,$9.14,-0.15,-1.615%,8094748074.00,United States,2008,23882427,Real Estate,Real Estate Investment Trusts
AGNCL,AGNC Investment Corp. Depositary Shares Each Representing a 1/1000th Interest in a Share of 7.75% Series G Fixed-Rate Reset Cumulative Redeemable Preferred Stock,$24.42,-0.34,-1.373%,21627324722.00,United States,,18319,Real Estate,Real Estate Investment Trusts
AGNCM,AGNC Investment Corp. Depositary Shares rep 6.875% Series D Fixed-to-Floating Cumulative Redeemable Preferred Stock,$25.01,-0.12,-0.478%,22149852223.00,United States,,10945,Real Estate,Real Estate Investment Trusts
