Symbol,Name,Last Sale,Net Change,% Change,Market Cap,Country,IPO Year,Volume,Sector,Industry
DGII,Digi International Inc. Common Stock,$28.38,-0.81,-2.775%,1038222588.00,United States,1989,226426,Telecommunications,Computer Communications Equipment
DGLY,Digital Ally Inc. Common Stock,$0.43,0.0299,7.473%,2378532.00,United States,,626656,Technology,Radio And Television Broadcasting And Communications Equipment
DGX,Quest Diagnostics Incorporated Common Stock,$151.79,-2.24,-1.454%,16942068324.00,United States,,935978,Health Care,Medical Specialities
DH,Definitive Healthcare Corp. Class A Common Stock,$4.22,-0.01,-0.236%,487506338.00,United States,2021,255986,Technology,Computer Software: Prepackaged Software
DHAI,DIH Holdings US Inc. Class A Common Stock,$1.45,-0.25,-14.706%,58790156.00,United States,2024,266162,Health Care,Medical/Dental Instruments
DHAIW,DIH Holding US Inc. Warrants,$0.05,0.00,0.00%,2027247.00,United States,2024,600225,Health Care,Medical/Dental Instruments
DHC,Diversified Healthcare Trust Common Shares of Beneficial Interest,$2.08,-0.06,-2.804%,501852776.00,United States,,886429,Real Estate,Real Estate Investment Trusts
DHCNI,Diversified Healthcare Trust 5.625% Senior Notes due 2042,$14.80,-0.09,-0.604%,3560504243.00,United States,,26364,Real Estate,Real Estate Investment Trusts
DHCNL,Diversified Healthcare Trust 6.25% Senior Notes Due 2046,$15.99,0.06,0.377%,3846788030.00,United States,,3638,Real Estate,Real Estate Investment Trusts
DHF,BNY Mellon High Yield Strategies Fund Common Stock,$2.57,-0.02,-0.772%,0.00,United States,1998,199339,Finance,Finance Companies
DHI,D.R. Horton Inc. Common Stock,$136.52,-3.38,-2.416%,43846063690.00,United States,,3523306,Consumer Discretionary,Homebuilding
DHIL,Diamond Hill Investment Group Inc. Class A Common Stock,$144.61,-5.39,-3.593%,393694362.00,United States,,23060,Finance,Investment Managers
DHR,Danaher Corporation Common Stock,$235.07,-3.02,-1.268%,169785217395.00,United States,,2863233,Industrials,Industrial Machinery/Components
DHT,DHT Holdings Inc.,$10.71,0.66,6.567%,1724305095.00,Jersey,2005,2774516,Consumer Discretionary,Marine Transportation
DHX,DHI Group Inc. Common Stock,$2.10,-0.08,-3.67%,101497784.00,United States,2007,300319,Consumer Discretionary,Business Services
DHY,Credit Suisse High Yield Bond Fund Common Stock,$2.13,-0.015,-0.699%,0.00,United States,1998,424956,Finance,Finance/Investors Services
DIAX,Nuveen Dow 30SM Dynamic Overwrite Fund Common Shares of Beneficial Interest,$14.86,-0.12,-0.801%,0.00,,2014,59661,Finance,Finance Companies
DIBS,1stdibs.com Inc. Common Stock,$3.51,0.02,0.573%,128160770.00,United States,2021,84784,Consumer Discretionary,Catalog/Specialty Distribution
DIN,Dine Brands Global Inc. Common Stock,$26.59,-0.79,-2.885%,405403717.00,United States,,852169,Consumer Discretionary,Restaurants
DINO,HF Sinclair Corporation Common Stock,$35.88,1.11,3.192%,6750888844.00,United States,1960,3416418,Energy,Natural Gas Distribution
DIOD,Diodes Incorporated Common Stock,$62.58,-2.31,-3.56%,2899511756.00,United States,,362571,Technology,Semiconductors
DIS,Walt Disney Company (The) Common Stock,$108.65,-1.11,-1.011%,196758555597.00,United States,,8771555,Consumer Discretionary,Services-Misc. Amusement & Recreation
DIST,Distoken Acquisition Corporation Ordinary Shares,$11.20,0.00,0.00%,0.00,China,2023,2,Finance,Blank Checks
DISTR,Distoken Acquisition Corporation Right,$0.1399,0.0197,16.389%,0.00,China,2023,1610,Finance,Blank Checks
DIT,AMCON Distributing Company Common Stock,$128.00,-2.02,-1.554%,82619136.00,United States,1999,112,Consumer Discretionary,Food Distributors
DJCO,Daily Journal Corp. (S.C.) Common Stock,$518.61,-38.76,-6.954%,714139454.00,United States,,22547,Consumer Discretionary,Newspapers/Magazines
DJT,Trump Media & Technology Group Corp. Common Stock,$35.31,0.77,2.229%,7659602259.00,United States,2024,6174365,Technology,Computer Software: Programming Data Processing
DJTWW,Trump Media & Technology Group Corp. Warrants,$23.89,0.28,1.186%,5182325063.00,United States,2021,92340,Technology,Computer Software: Programming Data Processing
DK,Delek US Holdings Inc. Common Stock,$18.87,0.47,2.554%,1192492764.00,United States,2017,1304648,Energy,Integrated oil Companies
DKL,Delek Logistics Partners L.P. Common Units representing Limited Partner Interests,$42.20,-0.15,-0.354%,2171893221.00,United States,2012,64032,Energy,Natural Gas Distribution
DKNG,DraftKings Inc. Class A Common Stock,$39.49,1.14,2.973%,19256419413.00,United States,2019,11445359,Consumer Discretionary,Services-Misc. Amusement & Recreation
DKS,Dick's Sporting Goods Inc Common Stock,$229.82,-3.71,-1.589%,18724494640.00,United States,2002,1255793,Consumer Discretionary,Other Specialty Stores
DLB,Dolby Laboratories Common Stock,$76.37,-0.74,-0.96%,7288432733.00,United States,2005,393963,Miscellaneous,Multi-Sector Companies
DLHC,DLH Holdings Corp.,$7.47,-0.39,-4.962%,107466916.00,United States,,25860,Consumer Discretionary,Professional Services
DLNG,Dynagas LNG Partners LP Common Units,$5.38,-0.08,-1.465%,198187219.00,Greece,,84619,Consumer Discretionary,Marine Transportation
DLNG^A,Dynagas LNG Partners LP 9.00% Series A Cumulative Redeemable Preferred Units,$25.70,0.20,0.784%,,Greece,,2802,,
DLNG^B,Dynagas LNG Partners LP 8.75% Series B Fixed to Floating Rate Cumulative Redeemable Perpetual Preferred Units liquidation preference $25.00 per Uni,$26.05,0.01,0.038%,,Greece,,3733,,
DLO,DLocal Limited Class A Common Shares,$11.235,-0.195,-1.706%,3325466356.00,Uruguay,2021,592258,Consumer Discretionary,Business Services
DLPN,Dolphin Entertainment Inc. Common Stock,$1.08,-0.04,-3.571%,12054988.00,United States,,29923,Consumer Discretionary,Other Consumer Services
DLR,Digital Realty Trust Inc. Common Stock,$173.34,-7.53,-4.163%,57499063124.00,United States,2004,2781429,Real Estate,Real Estate Investment Trusts
DLR^J,Digital Realty Trust Inc. 5.250% Series J Cumulative Redeemable Preferred Stock,$21.59,-0.391,-1.779%,,United States,,31914,,
DLR^K,Digital Realty Trust Inc. 5.850% Series K Cumulative Redeemable Preferred Stock par value $0.01 per share,$23.24,-0.292,-1.241%,,United States,,16900,,
DLR^L,Digital Realty Trust Inc. 5.200% Series L Cumulative Redeemable Preferred Stock,$20.90,-0.54,-2.519%,,United States,,47125,,
DLTH,Duluth Holdings Inc. Class B Common Stock,$2.88,-0.05,-1.706%,101310204.00,United States,2015,38793,Consumer Discretionary,Clothing/Shoe/Accessory Stores
DLTR,Dollar Tree Inc. Common Stock,$72.90,0.93,1.292%,15676316710.00,United States,1995,2703764,Consumer Discretionary,Department/Specialty Retail Stores
DLX,Deluxe Corporation Common Stock,$21.21,-0.78,-3.547%,939014338.00,United States,,243051,Consumer Discretionary,Publishing
DLY,DoubleLine Yield Opportunities Fund Common Shares of Beneficial Interest,$15.89,0.02,0.126%,761858428.00,United States,2020,163044,Finance,Investment Managers
DM,Desktop Metal Inc. Class A Common Stock,$2.70,-0.01,-0.369%,90021831.00,United States,2019,66048,Technology,Industrial Machinery/Components
DMA,Destra Multi-Alternative Fund Common Stock,$8.43,-0.05,-0.59%,0.00,,2022,67093,Finance,Trusts Except Educational Religious and Charitable
DMAC,DiaMedica Therapeutics Inc. Common Stock,$5.27,-0.19,-3.48%,225348267.00,United States,2018,65163,Health Care,Biotechnology: Pharmaceutical Preparations
DMB,BNY Mellon Municipal Bond Infrastructure Fund Inc. Common Stock,$10.34,-0.06,-0.577%,0.00,,2013,101048,Finance,Trusts Except Educational Religious and Charitable
DMF,BNY Mellon Municipal Income Inc. Common Stock,$7.08,-0.03,-0.422%,441019246.00,United States,1988,25358,Finance,Finance/Investors Services
DMLP,Dorchester Minerals L.P. Common Units Representing Limited Partnership Interests,$33.78,0.01,0.03%,1599136958.00,United States,,162652,Energy,Oil & Gas Production
DMN,Damon Inc. Common Stock,$0.766,-0.064,-7.711%,15907989.00,United Kingdom,,194117,Technology,EDP Services
DMO,Western Asset Mortgage Opportunity Fund Inc. Common Stock,$11.56,-0.01,-0.086%,0.00,United States,2010,59270,Finance,Trusts Except Educational Religious and Charitable
DMRC,Digimarc Corporation Common Stock,$42.29,-1.17,-2.692%,907196791.00,United States,,184744,Technology,EDP Services
DMYY,dMY Squared Technology Group Inc. Class A Common Stock,$10.70,0.00,0.00%,0.00,,2022,2,Finance,Blank Checks
DNA,Ginkgo Bioworks Holdings Inc. Class A Common Stock,$9.78,-1.33,-11.971%,562143691.00,United States,2021,1282495,Health Care,Biotechnology: Biological Products (No Diagnostic Substances)
DNB,Dun & Bradstreet Holdings Inc. Common Stock,$11.34,-0.29,-2.494%,5006898490.00,United States,2020,2915166,Finance,Finance: Consumer Services
DNLI,Denali Therapeutics Inc. Common Stock,$19.10,-2.15,-10.118%,2748903018.00,United States,2017,1302160,Health Care,Biotechnology: Biological Products (No Diagnostic Substances)
DNN,Denison Mines Corp Ordinary Shares (Canada),$1.95,-0.01,-0.51%,1740121369.00,Canada,,28672997,Basic Materials,Other Metals and Minerals
DNOW,DNOW Inc. Common Stock,$12.83,-0.13,-1.003%,1358006169.00,United States,2014,571976,Industrials,Metal Fabrications
DNP,DNP Select Income Fund Inc. Common Stock,$9.23,0.04,0.435%,0.00,United States,1987,1183546,Finance,Investment Managers
DNTH,Dianthus Therapeutics Inc. Common Stock,$24.20,-1.38,-5.395%,716246553.00,United States,2018,195078,Health Care,Biotechnology: Pharmaceutical Preparations
DNUT,Krispy Kreme Inc. Common Stock,$9.26,-0.06,-0.644%,1574200000.00,United States,2021,1379352,Consumer Staples,Food Chains
DOC,Healthpeak Properties Inc. Common Stock,$19.66,-0.66,-3.248%,13751048967.00,United States,,4555959,Real Estate,Real Estate Investment Trusts
DOCN,DigitalOcean Holdings Inc. Common Stock,$34.02,-0.46,-1.334%,3139443370.00,United States,2021,809031,Technology,Computer Software: Programming Data Processing
DOCS,Doximity Inc. Class A Common Stock,$52.10,-2.90,-5.273%,9726640748.00,United States,2021,2142020,Technology,EDP Services
DOCU,DocuSign Inc. Common Stock,$90.42,0.91,1.017%,18266932409.00,United States,1989,3603060,Technology,Computer Software: Prepackaged Software
DOGZ,Dogness (International) Corporation Class A Common Stock,$41.48,-0.71,-1.683%,528067694.00,China,2017,261972,Consumer Discretionary,Miscellaneous manufacturing industries
DOLE,Dole plc Ordinary Shares,$12.31,-0.42,-3.299%,1168578193.00,Ireland,2021,432438,Consumer Staples,Farming/Seeds/Milling
DOMH,Dominari Holdings Inc. Common Stock,$1.09,-0.088,-7.47%,6840990.00,United States,,33473,Health Care,Biotechnology: Pharmaceutical Preparations
DOMO,Domo Inc. Class B Common Stock,$6.80,-0.18,-2.579%,265931510.00,United States,2018,240012,Technology,Computer Software: Prepackaged Software
DOOO,BRP Inc. (Recreational Products) Common Subordinate Voting Shares,$50.99,-0.10,-0.196%,3722787905.00,Canada,,87409,Consumer Discretionary,Industrial Specialties
DORM,Dorman Products Inc. Common Stock,$121.75,-4.01,-3.189%,3715503677.00,United States,,196908,Consumer Discretionary,Auto Parts:O.E.M.
DOUG,Douglas Elliman Inc. Common Stock,$1.57,-0.01,-0.633%,139992176.00,United States,2021,1040837,Finance,Real Estate
DOV,Dover Corporation Common Stock,$183.64,-3.58,-1.912%,25193932636.00,United States,,1071976,Industrials,Industrial Machinery/Components
DOW,Dow Inc. Common Stock ,$38.50,-0.42,-1.079%,26953530065.00,United States,2019,7831882,Industrials,Major Chemicals
DOX,Amdocs Limited Ordinary Shares,$82.21,-2.00,-2.375%,9280733266.00,Guernsey,,608037,Technology,EDP Services
DOYU,DouYu International Holdings Limited ADS,$10.57,-0.15,-1.399%,334388017.00,China,2019,70541,Technology,Computer Software: Programming Data Processing
DPG,Duff & Phelps Utility and Infrastructure Fund Inc.,$11.45,-0.04,-0.348%,0.00,United States,2011,116578,Finance,Trusts Except Educational Religious and Charitable
DPRO,Draganfly Inc. Common Shares,$3.53,0.24,7.295%,14924116.00,Canada,,210458,Industrials,Aerospace
DPZ,Domino's Pizza Inc Common Stock,$402.33,-10.36,-2.51%,13893250709.00,United States,2004,586637,Consumer Discretionary,Food Distributors
DQ,DAQO New Energy Corp. American Depositary Shares each representing five ordinary shares,$19.20,-1.27,-6.204%,1267343059.00,China,2010,662717,Technology,Semiconductors
DRCT,Direct Digital Holdings Inc. Class A Common Stock,$1.64,0.45,37.815%,24055358.00,United States,2022,35661833,Consumer Discretionary,Advertising
DRD,DRDGOLD Limited American Depositary Shares,$9.24,0.17,1.874%,798879968.00,South Africa,,326753,Basic Materials,Precious Metals
DRDBU,Roman DBDR Acquisition Corp. II Unit,$9.9572,0.0072,0.072%,0.00,United States,2024,13423,,
DRH,Diamondrock Hospitality Company Common Stock,$8.74,-0.05,-0.569%,1814355915.00,United States,2005,1916487,Real Estate,Real Estate Investment Trusts
DRH^A,Diamondrock Hospitality Company 8.250% Series A Cumulative Redeemable Preferred Stock,$25.1914,-0.2305,-0.907%,,United States,,7907,,
DRI,Darden Restaurants Inc. Common Stock,$180.02,-3.71,-2.019%,21088764416.00,United States,,1293266,Consumer Discretionary,Restaurants
DRIO,DarioHealth Corp. Common Stock,$0.92,0.02,2.222%,31368647.00,Israel,,348603,Health Care,Medical/Dental Instruments
DRMA,Dermata Therapeutics Inc. Common Stock,$1.20,-0.06,-4.762%,2448922.00,United States,2021,87873,Health Care,Biotechnology: Pharmaceutical Preparations
DRMAW,Dermata Therapeutics Inc. Warrant,$0.0112,-0.0036,-24.324%,22857.00,United States,2021,1300,Health Care,Biotechnology: Pharmaceutical Preparations
DRRX,DURECT Corporation Common Stock,$0.771,-0.036,-4.461%,23933367.00,United States,2000,148604,Health Care,Biotechnology: Pharmaceutical Preparations
DRS,Leonardo DRS Inc. Common Stock,$33.06,-0.22,-0.661%,8740966771.00,Israel,,468438,Industrials,Industrial Machinery/Components
DRTS,Alpha Tau Medical Ltd. Ordinary Shares,$3.23,-0.33,-9.27%,225036077.00,Israel,,127032,Health Care,Medical/Dental Instruments
DRTSW,Alpha Tau Medical Ltd. Warrant,$0.251,0.041,19.524%,17487324.00,Israel,,25789,Health Care,Medical/Dental Instruments
DRUG,Bright Minds Biosciences Inc. Common Stock,$38.89,-2.15,-5.239%,271801782.00,Canada,,48725,Health Care,Biotechnology: Pharmaceutical Preparations
DRVN,Driven Brands Holdings Inc. Common Stock,$15.23,-0.27,-1.742%,2499457728.00,United States,2021,425019,Consumer Discretionary,Automotive Aftermarket
DSGN,Design Therapeutics Inc. Common Stock,$4.52,-0.555,-10.936%,255927087.00,United States,2021,294612,Health Care,Biotechnology: Pharmaceutical Preparations
DSGR,Distribution Solutions Group Inc. Common Stock,$33.25,-1.78,-5.081%,1557359510.00,United States,,50011,Consumer Discretionary,Industrial Specialties
DSGX,Descartes Systems Group Inc. (The) Common Stock,$111.37,-1.785,-1.577%,9526527099.00,Canada,,275422,Technology,Computer Software: Prepackaged Software
DSL,DoubleLine Income Solutions Fund Common Shares of Beneficial Interests,$12.57,-0.09,-0.711%,1282100128.00,United States,2013,266861,Finance,Trusts Except Educational Religious and Charitable
DSM,BNY Mellon Strategic Municipal Bond Fund Inc. Common Stock,$5.79,-0.04,-0.686%,0.00,United States,1989,91032,Finance,Investment Managers
DSP,Viant Technology Inc. Class A Common Stock,$17.43,-0.72,-3.967%,1095507275.00,United States,2021,159668,Technology,Computer Software: Programming Data Processing
DSS,DSS Inc. Common Stock,$0.93,-0.02,-2.105%,6572098.00,United States,,4993,Consumer Discretionary,Containers/Packaging
DSU,Blackrock Debt Strategies Fund Inc. Common Stock,$10.79,-0.07,-0.645%,0.00,United States,1998,202300,Finance,Finance Companies
DSWL,Deswell Industries Inc. Common Shares,$2.425,0.025,1.042%,38642955.00,Macau,1995,21771,Industrials,Plastic Products
DSX,Diana Shipping inc. common stock,$1.90,0.04,2.151%,227929542.00,Greece,2005,567676,Consumer Discretionary,Marine Transportation
DSX^B,Diana Shipping Inc. Perpetual Preferred Shares Series B (Marshall Islands),$26.25,0.00,0.00%,,Greece,,2046,,
DSY,Big Tree Cloud Holdings Limited Ordinary Shares,$3.12,-0.13,-4.00%,178091304.00,China,,125889,Consumer Discretionary,Containers/Packaging
DSYWW,Big Tree Cloud Holdings Limited Warrants,$0.0322,0.0016,5.229%,1837994.00,China,,3631,Consumer Discretionary,Containers/Packaging
DT,Dynatrace Inc. Common Stock,$50.69,-1.54,-2.948%,15130155024.00,United States,2019,3036536,Technology,Computer Software: Prepackaged Software
DTB,DTE Energy Company 2020 Series G 4.375% Junior Subordinated Debentures due 2080,$17.91,-0.22,-1.213%,3709171495.00,United States,2020,20682,Utilities,Electric Utilities: Central
DTC,Solo Brands Inc. Class A Common Stock,$1.06,-0.02,-1.852%,97171907.00,United States,2021,151956,Consumer Discretionary,Recreational Games/Products/Toys
DTCK,Davis Commodities Limited Ordinary Shares,$1.105,0.075,7.282%,27073191.00,Singapore,2023,121148,Industrials,Farming/Seeds/Milling
DTE,DTE Energy Company Common Stock,$119.02,-1.99,-1.644%,24649111746.00,United States,,1082776,Utilities,Electric Utilities: Central
DTF,DTF Tax-Free Income 2028 Term Fund Inc. Common Stock,$11.165,0.005,0.045%,78485116.00,United States,1991,19678,Finance,Investment Managers
DTG,DTE Energy Company 2021 Series E 4.375% Junior Subordinated Debentures,$17.95,-0.28,-1.536%,3717455519.00,United States,2021,63355,Utilities,Electric Utilities: Central
DTI,Drilling Tools International Corporation Common Stock,$3.29,-0.04,-1.201%,114178450.00,United States,2021,42688,Industrials,Metal Fabrications
DTIL,Precision BioSciences Inc. Common Stock,$5.70,1.20,26.667%,43725036.00,United States,2019,19236584,Health Care,Biotechnology: Biological Products (No Diagnostic Substances)
DTM,DT Midstream Inc. Common Stock ,$103.49,-2.27,-2.146%,10054689343.00,United States,2021,817104,Utilities,Natural Gas Distribution
DTSQ,DT Cloud Star Acquisition Corporation Ordinary Shares,$10.105,0.015,0.149%,0.00,United States,2024,1000,,
DTSS,Datasea Inc. Common Stock,$2.25,-0.02,-0.881%,15945755.00,China,,48676,Technology,Computer Software: Prepackaged Software
DTST,Data Storage Corporation Common Stock,$4.66,-0.06,-1.271%,32686978.00,United States,,69049,Technology,EDP Services
DTSTW,Data Storage Corporation Warrant,$0.60,-0.09,-13.043%,4208624.00,United States,,2124,Technology,EDP Services
DTW,DTE Energy Company 2017 Series E 5.25% Junior Subordinated Debentures due 2077,$21.46,-0.36,-1.65%,4444378576.00,United States,2017,34934,Utilities,Electric Utilities: Central
DUK,Duke Energy Corporation (Holding Company) Common Stock,$105.87,-2.36,-2.181%,81782712217.00,United States,,2998145,Utilities,Power Generation
DUK^A,Duke Energy Corporation Depositary Shares each representing a 1/1000th interest in a share of 5.75% Series A Cumulative Redeemable Perpetual Preferred Stock,$24.26,-0.33,-1.342%,,United States,,126868,,
DUKB,Duke Energy Corporation 5.625% Junior Subordinated Debentures due 2078,$23.47,-0.07,-0.297%,18130162045.00,United States,2018,49371,Utilities,Power Generation
DUO,Fangdd Network Group Ltd. Class A Ordinary Shares,$0.5376,-0.0676,-11.17%,3424512.00,China,2019,2580780,Finance,Real Estate
DUOL,Duolingo Inc. Class A Common Stock,$318.67,-4.47,-1.383%,14016559098.00,United States,2021,533391,Technology,Computer Software: Prepackaged Software
DUOT,Duos Technologies Group Inc. Common Stock,$5.66,-0.275,-4.634%,47604138.00,United States,,129774,Technology,Computer Software: Prepackaged Software
DV,DoubleVerify Holdings Inc. Common Stock,$19.32,-0.64,-3.206%,3268267974.00,United States,2021,1893879,Technology,Computer Software: Programming Data Processing
DVA,DaVita Inc. Common Stock,$153.40,-0.56,-0.364%,12578800000.00,United States,,458457,Health Care,Misc Health and Biotechnology Services
DVAX,Dynavax Technologies Corporation Common Stock,$12.63,0.01,0.079%,1660271105.00,United States,2004,1708042,Health Care,Biotechnology: Pharmaceutical Preparations
DVN,Devon Energy Corporation Common Stock,$35.99,0.84,2.39%,23641831000.00,United States,1985,14058245,Energy,Oil & Gas Production
DWSN,Dawson Geophysical Company Common Stock,$1.36,-0.11,-7.483%,42137474.00,United States,,6816,Energy,Oil & Gas Production
DWTX,Dogwood Therapeutics Inc. Common Stock,$2.36,-0.02,-0.84%,3143940.00,United States,2020,6627,Health Care,Biotechnology: Pharmaceutical Preparations
DX,Dynex Capital Inc. Common Stock,$12.24,-0.26,-2.08%,970675134.00,United States,,2099162,Real Estate,Real Estate Investment Trusts
DX^C,Dynex Capital Inc. 6.900% Series C Fixed-to-Floating Rate Cumulative Redeemable Preferred Stock,$25.09,-0.11,-0.437%,,United States,,2954,,
DXC,DXC Technology Company Common Stock ,$19.47,-1.05,-5.117%,3524546762.00,United States,,1046803,Technology,EDP Services
DXCM,DexCom Inc. Common Stock,$77.76,-2.33,-2.909%,30372697526.00,United States,2005,4716867,Health Care,Medical/Dental Instruments
DXLG,Destination XL Group Inc. Common Stock,$2.63,0.01,0.382%,142828033.00,United States,,448984,Consumer Discretionary,Clothing/Shoe/Accessory Stores
DXPE,DXP Enterprises Inc. Common Stock,$90.99,6.24,7.363%,1428077404.00,United States,,544309,Industrials,Industrial Machinery/Components
DXR,Daxor Corporation Common Stock,$8.222,0.257,3.227%,39794480.00,United States,,17939,Health Care,Medical/Dental Instruments
DXYZ,Destiny Tech100 Inc. Common Stock,$56.45,-1.65,-2.84%,0.00,,2024,1225040,,
DY,Dycom Industries Inc. Common Stock,$176.47,-2.53,-1.413%,5148664897.00,United States,,293899,Industrials,Water Sewer Pipeline Comm & Power Line Construction
DYAI,Dyadic International Inc. Common Stock,$1.65,-0.075,-4.348%,48822462.00,United States,,72233,Health Care,Biotechnology: Biological Products (No Diagnostic Substances)
DYCQ,DT Cloud Acquisition Corporation Ordinary Shares,$10.46,0.00,0.00%,0.00,United Kingdom,2024,4,,
DYCQR,DT Cloud Acquisition Corporation Right,$0.20,0.00,0.00%,0.00,United Kingdom,2024,10,,
DYN,Dyne Therapeutics Inc. Common Stock,$15.87,-7.18,-31.15%,1615025753.00,United States,2020,9824767,Health Care,Biotechnology: Pharmaceutical Preparations
DYNX,Dynamix Corporation Class A Ordinary Shares,$9.79,0.00,0.00%,0.00,United States,2024,300,,
DYNXU,Dynamix Corporation Unit,$9.9166,-0.0034,-0.034%,0.00,United States,2024,2937,,
DYNXW,Dynamix Corporation Warrant,$0.28,0.01,3.704%,0.00,United States,2024,503,,
E,ENI S.p.A. Common Stock,$28.13,0.14,0.50%,47482566479.00,Italy,,423345,Energy,Oil & Gas Production
EA,Electronic Arts Inc. Common Stock,$140.85,-3.35,-2.323%,36941126838.00,United States,,2285251,Technology,Computer Software: Prepackaged Software
EAD,Allspring Income Opportunities Fund Common Shares,$6.95,-0.05,-0.714%,0.00,United States,2003,200654,Finance,Finance/Investors Services
EAF,GrafTech International Ltd. Common Stock,$1.60,-0.10,-5.882%,411467403.00,United States,2018,1697418,Energy,Industrial Machinery/Components
EAI,Entergy Arkansas LLC First Mortgage Bonds 4.875% Series Due September 1 2066,$20.77,-0.54,-2.534%,4453254451.00,United States,2016,80996,Utilities,Electric Utilities: Central
EARN,Ellington Credit Company Common Shares of Beneficial Interest,$6.43,-0.10,-1.531%,185186218.00,United States,2013,569038,Real Estate,Real Estate Investment Trusts
EAST,Eastside Distilling Inc. Common Stock,$0.8299,-0.0201,-2.365%,4142085.00,United States,,37325,Consumer Staples,Beverages (Production/Distribution)
EAT,Brinker International Inc. Common Stock,$138.48,-1.04,-0.745%,6152401765.00,United States,,1161087,Consumer Discretionary,Restaurants
EB,Eventbrite Inc. Class A Common Stock,$3.30,-0.15,-4.348%,319706901.00,United States,2018,943272,Technology,Computer Software: Programming Data Processing
EBAY,eBay Inc. Common Stock,$65.90,-3.50,-5.043%,31566100000.00,United States,1998,8233286,Consumer Discretionary,Business Services
EBC,Eastern Bankshares Inc. Common Stock,$16.60,-0.55,-3.207%,3563412755.00,United States,2020,983471,Finance,Savings Institutions
EBF,Ennis Inc. Common Stock,$20.20,-0.55,-2.651%,525454581.00,United States,,204972,Consumer Discretionary,Office Equipment/Supplies/Services
EBMT,Eagle Bancorp Montana Inc. Common Stock,$14.51,-0.34,-2.29%,116323536.00,United States,2010,19964,Finance,Major Banks
EBON,Ebang International Holdings Inc. Class A Ordinary Shares,$5.7818,-0.2482,-4.116%,37835741.00,China,2020,26341,Technology,Semiconductors
EBR,Centrais Electricas Brasileiras S A American Depositary Shares (Each representing one Common Share),$5.60,-0.10,-1.754%,12576559979.00,Brazil,2016,2313696,Utilities,Electric Utilities: Central
EBS,Emergent BioSolutions Inc. Common Stock,$9.88,-0.21,-2.081%,535339758.00,United States,2006,949565,Health Care,Biotechnology: Pharmaceutical Preparations
EBTC,Enterprise Bancorp Inc Common Stock,$37.23,-1.08,-2.819%,462738744.00,United States,,43015,Finance,Major Banks
EC,Ecopetrol S.A. American Depositary Shares,$8.49,0.01,0.118%,17454036900.00,Colombia,,3355791,Energy,Oil & Gas Production
ECAT,BlackRock ESG Capital Allocation Term Trust Common Shares of Beneficial Interest,$16.47,-0.11,-0.663%,1780983450.00,United States,2021,370768,Finance,Trusts Except Educational Religious and Charitable
ECBK,ECB Bancorp Inc. Common Stock,$13.61,-0.02,-0.147%,124089461.00,United States,2022,5262,Finance,Banks
ECC           ,Eagle Point Credit Company Inc. Common Stock,$9.11,-0.01,-0.11%,552635594.00,United States,2014,1161143,Finance,Trusts Except Educational Religious and Charitable
ECC^D,Eagle Point Credit Company Inc. 6.75% Series D Preferred Stock,$19.66,-0.04,-0.203%,,United States,,14668,,
ECCC,Eagle Point Credit Company Inc. 6.50% Series C Term Preferred Stock due 2031,$22.96,0.12,0.525%,1392811551.00,United States,,4514,Finance,Trusts Except Educational Religious and Charitable
ECCF,Eagle Point Credit Company Inc. 8.00% Series F Term Preferred Stock due 2029,$24.9846,-0.0154,-0.062%,27200055138.00,United States,,5737,,
ECCU,Eagle Point Credit Company Inc. 7.75% Notes due 2030,$24.85,0.00,0.00%,0.00,United States,2024,37304,,
ECCV,Eagle Point Credit Company Inc. 5.375% Notes due 2029,$22.7399,0.0599,0.264%,1379459730.00,United States,2022,1023,Finance,Trusts Except Educational Religious and Charitable
